,hash,origin,title,author,published,url,text
0,ba3cac9d6b216567c83b25702d05f97c16d54580db7c5fe2d4a52213db561680,coin_telegraph,How a crypto trader turned $3K into $2M after CZ mentioned a memecoin,Bradley Peak,2025-10-15 00:00,https://cointelegraph.com/news/how-a-crypto-trader-turned-3k-into-2m-after-cz-mentioned-a-memecoin,"Key takeaways: CZ’s mention turned meme token “4” into a trade; one early buyer saw $3,000 grow to $2 million.The trigger was the hack of BNB Chain’s X account, which spawned “4.”The surge came from flow hitting thin liquidity, not fundamentals.Some wallets had already bought moments before CZ’s post.On Oct. 1, 2025, BNB Chain’s official X account was hijacked and used to push phishing links. Within hours, the drama spun into a joke token on BNB Chain called “4,” a playful nod to reports that the attacker made off with only about $4,000.Then, Changpeng “CZ” Zhao, Binance’s co-founder and former CEO, referenced the incident.That single mention turned a niche gag into a live market signal as attention flooded into a brand-new pool with barely any liquidity.In the rush that followed, one early buyer put about $3,000 worth of BNB (BNB) into “4” and watched it mark up to around $2 million on screen within hours.Did you know? When CZ tweets “4,” he’s referencing point #4 from his 2023 “Do’s & Don’ts” list: Ignore FUD, fake news, attacks, etc. It became a community shorthand long before the 4 memecoin appeared.How a meme turned into a move1. BNB Chain account hijacked (Oct. 1, 2025)BNB Chain’s official X account was compromised and used to post phishing links to roughly 4 million followers. The team later regained control and issued warnings. Out of the chaos came a running joke that the attacker made off with only “$4k.”2. A joke gets a tickerWithin hours, a new token called 4 launched on BNB Chain — a wink at the “$4k” meme. Early buyers began circling a brand-new liquidity pool that was barely funded.3. CZ amplifies itChangpeng “CZ” Zhao referenced the incident to his 10.3 million followers, noting the hacker’s small profit and how the community “bought the memecoin higher.” What began as a joke quickly turned into a live trade signal. Human traders and bots now had a ticker to chase.4. The first wave of orders hitsScanners flagged the contract, copy traders queued buys, and retail flowed through aggregators into the same shallow pool. With wafer-thin depth, each filled order lifted the next quote. Slippage widened, momentum compounded, and the chart turned near-vertical.5. The headline wallet is already inAn address labeled “0x872” bought in early with about $3,000 worth of BNB. As attention flooded the pool and liquidity thinned, that small stake swelled to roughly $2 million within hours.Inside the winning walletThe wallet that grabbed headlines (“0x872”) didn’t look like a mastermind. It put around $3,000 worth of BNB into a freshly minted token and, as attention hit, watched its mark-to-market soar.What turned a modest position into a paper fortune was getting in early on a thin pool. When liquidity is shallow, every new buyer pushes up the next quote you’d sell into — whether you actually sell or not.Then came the moment every speculator both wants and dreads: life-changing numbers on screen with almost no depth underneath.Onchain traces show only light profit-taking. The address kept over 98% of its portfolio in 4, still around $1.88 million after the first spike, maximizing upside if momentum held, but leaving the position exposed if a single decent market sell hit the pool.The screenshots told the same story: roughly $1.8 million in unrealized profit over the week.“Unrealized” is the operative word. Until an order fills, profit and loss (PnL) is just a suggestion. In venues where one sale can move the price several percentage points, even trimming requires intent and a plan. Many traders learn this by round-tripping a win back to par; this wallet, for a time, chose to ride.Flow around the wallet fed the loop. “Smart money” addresses tracked by Lookonchain began buying 4, pushing it into the most accumulated BNB Chain tokens over the next 24 hours.That feedback loop magnified reflexivity. As more screens lit up and copy trades fired, the early holder’s unrealized value kept climbing — until a larger seller finally tested the pool’s depth.0x872’s outcome hinged on two choices: stepping in absurdly early and resisting the immediate urge to cash out.Did you know? 0x872 wasn’t alone. Another wallet had reportedly bought minutes before CZ’s post and was up seven figures within hours — a reminder that fast alerts and feed monitoring can create a real edge in meme-driven bursts.When hype outruns depthSo, what’s in store for the headline wallet? Maximum upside if momentum holds and maximum downside if a single decent sell order hits a shallow pool.But we shouldn’t lose sight of the catalyst: a compromised official account. Spikes like this attract phishers and look-alike contracts. The takeaway is procedural. Verify the contract and the pool size, script an exit in advance and treat screenshots as suggestions until a fill clears.Posts create flow, not value, and the exit door is narrower than it looks.This article does not contain investment advice or recommendations. Every investment and trading move involves risk, and readers should conduct their own research when making a decision."
1,a174f10de7915495b70d7a000b333b321cb76fa64ab328ac6e67909430dd9e92,coin_telegraph,Data shows 76% of retail traders are long SOL: Will rebound to $200 hold?,Biraajmaan Tamuly,2025-10-15 00:00,https://cointelegraph.com/news/data-shows-76percent-of-retail-traders-are-long-sol-will-a-rebound-to-dollar200-hold,"Key takeaways:76% of retail traders are net long on Solana, a historically bullish signal.Treasury firms and institutions are accumulating SOL below $200.Whale activity is rising ahead of the spot SOL ETF decision on Thursday.Solana (SOL) prices under $200 could be an undervalued range, according to new data highlighting a rare bullish skew among retail traders.Onchain analytics platform Hyblock said that SOL is currently the only major crypto asset that has the highest percentile when it comes to true retail long percentage (TRA). The trading platform said in an X post, “Around 76% of retail accounts currently hold net long positions on Solana, a threshold that historically aligns with positive forward returns.”Hyblock’s backtest of the signal shows that whenever TRA exceeds 75%, SOL’s seven-day mean and median forward returns rise from around +2.25% to over +5%, while average drawdowns decrease. The analysis added that the risk–reward ratio (RR) nearly doubles during these instances, suggesting stronger follow-through on upward moves and reduced downside volatility.Solana retail long position analysis. Source: Hyblock Capital/XLikewise, crypto analyst Darkfost offered an optimistic outlook, pointing to broader altcoin capitulation as a potential accumulation phase. The trader said that only 10% of Binance-listed altcoins remain above their 200-day moving average, indicating widespread fear and disinterest. Historically, such conditions have preceded notable market rebounds. Darkfost said, “The best time to gain exposure to altcoins is often when no one wants them anymore,” emphasizing that previous cycles saw similar setups resolve in strong short-term recoveries.Percentage of altcoins above the 200D-SMA on Binance. Source: XAt the moment, corporate digital asset treasuries appear to be taking advantage of SOL’s sub-$200 pricing. Solana treasury company Solmate (Nasdaq: SLMT) purchased $50 million worth of SOL from the Solana Foundation at a 15% discount, with ARK Invest disclosing a new 11.5% ownership stake. Solmate had earlier raised $300 million to build its digital asset treasury. Meanwhile, treasury firm SOL Strategies (Nasdaq: STKE) acquired an additional 88,433 SOL, including 79,000 locked SOL from the foundation at an average price of $193.93 per coin, bringing its total holdings to 523,433 SOL. These moves underline coordinated accumulation by institutional players at current price levels.Related: Bitcoin buyers build bids at $105K as crypto market meltdown nears conclusionCan SOL hold a position above $200?While SOL’s long-term outlook remains constructive, its recent dip and daily close below $190 marked the first bearish break of structure since February, signaling a potential shift in momentum on higher time frames. Although SOL briefly reclaimed its 200-day exponential moving average (EMA), it now trades between the 50-day and 100-day EMAs. This compression typically reflects indecision, where short-term momentum weakens while medium-term support holds, often preceding a larger directional move.Traders may continue bidding under $200, but a swift recovery could be limited. However, SOL recently retested long-term demand zones from $190 to $170, likely absorbing earlier buy orders during the Oct. 10 flash crash. A continuation might see SOL consolidate to $160 from $200 if the bullish momentum remains underwhelming in the coming days. SOL one-day chart. Source: Cointelegraph/TradingViewDespite the short-term bearish setup, market analyst Pelin Ay said that whale order activity on SOL has started increasing again, a trend that has historically preceded rallies of 40%–70%. The analyst said the whales are positioning ahead of the Thursday spot SOL ETF decision, which could catalyze stronger spot demand. Combined with SOL’s high staking ratio and potential inclusion in multiple publicly listed indexes, a favorable ETF outcome could tighten supply and re-establish SOL’s bullish trajectory above $200. SOL spot average order size. Source: CryptoQuantRelated: Ether drops 8%, but traders say ETH price breakout to $10K is ‘loading’This article does not contain investment advice or recommendations. Every investment and trading move involves risk, and readers should conduct their own research when making a decision."
2,fdc0a9213793624e3ef00669aafa60b43c176e7d76e681aa020f2f0c3eb57647,coin_telegraph,Stocks vs. Bitcoin in the AI era: Which will survive the next 50 years?,Emi Lacapra,2025-10-14 00:00,https://cointelegraph.com/news/stocks-vs-bitcoin-in-the-ai-era-which-will-survive-the-next-50-years,"Key takeawaysStocks may survive AI disruption if they adapt quickly to changing technological and economic demands.New businesses spurred by AI, such as robotics, biotech or space, are expected to drive growth, and the stocks mirroring such advances will have a better chance of surviving the innovation turmoil.Periods of disruption should be expected as AI reshapes labor and markets; therefore, the next few years are for adaptation to the new technology.Bitcoin’s future rests on proving itself as a true store of value but also transitioning into a medium of exchange. AI can facilitate this, mainly by impacting scalability and transaction processes.As a decentralized system, Bitcoin is not affected by internal politics, whose human element could disrupt its operations. It only has to stay up-to-date with the new tech to remain relevant.Nobody has the means to predict what will happen within the next 50 years, especially not in a financial market that is influenced by so many external factors.However, analyzing the current status of AI and its impact on fintech sectors such as Bitcoin and stocks, it’s possible to understand what would be the best investment choice between these financial tools.The purpose of this article is to help you make more informed decisions and understand if Bitcoin or stocks is a better choice for you in the future.Stocks or Bitcoin: Which will survive the AI revolution?AI will accelerate innovation and efficiency in several industries, sectors and aspects of our lives, surely advancing improvements in tech like Bitcoin in terms of efficiency and, hopefully, scaling. But how about stocks? Is their investment concept a thing of the past? Let’s find out a little bit more.What is the case for stocks?The world’s first stock market took shape in Amsterdam in 1602 with the founding of the Dutch East India Company. What began as a marketplace for trading company shares soon became a model for raising capital and investing. By the late 17th century, London had developed its own trading hubs, while New York’s exchange would not emerge until 1792, spreading the model across the Atlantic.Stocks represent ownership in companies, and the stock market is where investors buy and sell them. Stock values fluctuate based on company performance and market conditions, including the ability to adapt to technological changes like AI.Stocks of businesses that embraced technological advancements over the centuries have survived economic cycles, wars and disruptions that technology brought along. Without the benefit of hindsight, the same seems likely for companies betting on AI.Specifically, companies that apply AI through automation, data analytics and new business models are likely to succeed.Historically, market indexes like the S&P 500 have delivered approximately 7%-10% annualized returns over decades, adjusted for inflation. The index tracks the performance of 500 of the largest publicly traded US companies and is widely used as a benchmark for the overall stock market.Compared to the S&P 500, Bitcoin’s (BTC) performance has been exceptionally higher, as shown in the table below:What is the case for Bitcoin?Bitcoin is a relatively new invention, created in 2009 by the pseudonymous Satoshi Nakamoto.The project was introduced in a white paper detailing a peer-to-peer electronic cash system using blockchain technology.The case for Bitcoin goes beyond the investment tool or store of value conception. Its proposal includes a true monetary revolution, which challenges gold and other financial tools.Its decentralized design resists central control and the inflation common in fiat systems. With a fixed supply capped at 21 million coins, Bitcoin’s scarcity appeals to those seeking protection against monetary debasement.Furthermore, blockchain’s transparency and security align well with AI’s need for verifiable data.Over the years, Bitcoin has established itself as both a store of value and an alternative currency, while still pursuing its original goal of becoming a widely used medium of exchange.How AI affects stocks and the stock marketThe next 50 years could challenge the survival of the stock market as an institution due to “artificial intelligence speeding up innovation cycles, making public companies inefficient investment vehicles,” as predicted by analyst and investor Jordi Visser.Stocks have been around a long time, but AI-driven disruptions leave little room for complacency, and companies that fail to adjust risk falling behind. This is especially true for tech giants like the FAANG stocks (Facebook, Amazon, Apple, Netflix and Google). While they are among the biggest investors in AI, these companies will still need to keep pace with rapid developments and adopt them effectively.AI will also have an impact on the stock market, from quickly analyzing huge amounts of data to predicting market movements and automating decision-making processes, for faster and more efficient operations. AI will have an enormous impact on the way investors approach trading and investment strategies.Overall, AI will likely boost corporate innovation but also widen the gap between adaptable and stagnant firms.How AI affects BitcoinVisser sees Bitcoin as a better future investment and compares it to gold, which has endured for thousands of years.Beyond its role as a store of value, Bitcoin is well-placed in the future of finance. The combination of AI and blockchain may disrupt traditional financial systems, bringing more capital and participants into the digital economy.AI is expected to improve Bitcoin security and trading strategies, improving crypto trading through automated tools, enhanced data analysis and market pattern prediction. All these changes may also trigger better system efficiency.Bitcoin mining will also benefit from AI in terms of efficiency and better resource allocation by predicting optimal times for mining activity to reduce costs and maximize output. System maintenance will improve as AI can detect existing or upcoming failures, thereby increasing its overall reliability.However, Bitcoin faces regulatory risks, scalability issues and volatility, which may deter risk-averse investors who generally prefer more predictable and stable investment tools such as stocks.The convergence of AI and blockchain could trigger a new era for Bitcoin, nurturing broader adoption by creating a more intuitive and secure ecosystem, giving it an edge over stagnant stocks.Which will survive the next 50 years?Looking 50 years ahead is practically impossible. Both Bitcoin and stocks have unique strengths and weaknesses, and their future ultimately depends on economic, technological and societal changes.Stocks will likely endure if they adapt to AI-driven economies. Investors can mitigate risks of individual company failures by putting money into diversified portfolios, like index funds, which appear more secure. Stocks in robotics, biotech, space and AI may perform better than less tech-driven assets.The advent of quantum computing is often discussed in relation to Bitcoin’s security model, though most experts agree the risk is still theoretical and distant. Combined with AI, its impact could be positive or negative depending on how the technology evolves and how the Bitcoin network adapts. Mining centralization might also be a concern if only a few entities gain early access to advanced quantum-AI systems.On the other hand, the combination could be advancing Bitcoin security and network optimization by improving transaction processing, wallet security or blockchain analytics, enhancing Bitcoin’s efficiency and user experience. As long as the Bitcoin community stays ahead of the curve with quantum-resistant upgrades, the net impact could be positive.As decentralized finance gains traction in investments, Bitcoin also enhances its competitive edge over gold. By doing so, it is emerging as a superior store of value and encouraging traditional markets to shift funds to digital finance.This article does not contain investment advice or recommendations. Every investment and trading move involves risk, and readers should conduct their own research when making a decision."
3,b307fc0fd678e36c848f077c6bb6cfd21ec10a1d4041d599cd4ffd3f18672308,coin_telegraph,"Bitcoin to $74K? Hyperliquid whale opens new 1,240 BTC short",Nancy Lubale,2025-10-15 00:00,https://cointelegraph.com/news/bitcoin-to-74k-hyperliquid-whale-opens-new-1240-btc-short,"Key takeaways:Bitcoin's rising wedge pattern suggests a potential drop to $74,000 if a key support level fails.A new whale has placed $140 million in short bets on BTC.Bitcoin’s (BTC) technical setup suggests a deeper correction to $74,000 is possible, as whales have increased their short exposure to BTC.Bitcoin’s rising wedge targets a 34% price dropThe weekly chart shows the BTC/USD pair trading within a rising wedge, with the price testing support from the lower trendline of the pattern at $110,000. Related: US Bitcoin and Ether ETFs rebound as Powell signals rate cutsA weekly candlestick close below this level will clear that path for Bitcoin’s drop toward the wedge’s bearish target at $74,000, representing a 34% decline from the current price. This also coincides with its previous peak reached in March 2024. BTC/USD daily price chart. Source: Cointelegraph/TradingViewBitcoin’s bearish case is supported by a growing bullish divergence between its price and the relative strength index, as shown in the chart above.Rising wedges are typically bearish reversal patterns, and BTC’s continued consolidation within the pattern’s trendlines suggests that “Bitcoin’s bull run is nearing its end,” according to analyst Captain Faibik. “Bitcoin is still inside the rising wedge and bulls are in control for now, but not for long,” the analyst said in an X post on Wednesday, adding:“Momentum is fading, and once the wedge breaks, bears will take over with a sharp correction ahead.”Veteran trader Peter Brandt said Bitcoin could see a “major shakeout” before returning to its all-time highs above $126,000.“I think the day of the 80% decline is over, but perhaps back to $50-60,000 and test the lower skin of the banana.”As Cointelegraph reported, several technical and onchain metrics suggest that the BTC/USD pair could drop to $74,000 in the worst-case scenario if the price failed to hold above the $110,000 support level. Bitcoin whale places $140 million BTC short betBitcoin bears doubled down on their BTC short exposures as calls for deeper price drawdown have grown louder. Data from Lookonchain shows that a Hyperliquid whale has placed a short position worth $140 million, at 5x leverage and a liquidation price of $137,700.Another whale, 0xc2a3, just opened a 5x short on 1,240 $BTC($140M) on #Hyperliquid. Liquidation price: $137,700https://t.co/9PPQWCKRHj pic.twitter.com/3yLHGDKMAi— Lookonchain (@lookonchain) October 15, 2025 This is not the only whale betting on Bitcoin’s downside. On Tuesday, another Bitcoin whale that shorted BTC last week added to a $500 million downside bet, with 10x leverage.Meanwhile, onchain data showed that the ratio of unrealized profit and loss (NUPL) has shifted from “optimism” to “euphoria,” a trend that has preceded blow-off tops in the past.This article does not contain investment advice or recommendations. Every investment and trading move involves risk, and readers should conduct their own research when making a decision."
4,5465a920f3ad34a8af072f89a30f9c775dcfd6ad16a003aa8b2dc807626750e7,coin_telegraph,Bitcoin metric shows ‘euphoria’ as $112.5K BTC price squeezes new buyers,William Suberg,2025-10-15 00:00,https://cointelegraph.com/news/bitcoin-euphoria-112-5k-btc-price-squeezes-new-buyers,"Key points:Bitcoin’s NUPL metric repeats past bull-market tops with a move from “optimism” to “euphoria.”The Bitcoin realized cap is increasingly in the hands of short-term holders.New investors continue to get squeezed by range-bound BTC price performance. Bitcoin (BTC) may be in its “final expansion” to a blow-off top despite recent lows, new research says. In one of its Quicktake blog posts on Wednesday, onchain analytics platform CryptoQuant showed BTC price history repeating itself.Bitcoin NUPL implies “shift from optimism to euphoria”Bitcoin is headed for its new cycle top as the balance of control between old and new hodlers shifts.CryptoQuant data revealed that the ratio of unrealized profit and loss (NUPL) has crossed into territory that has accompanied previous blow-off tops.“The NUPL currently sits at +0.52, a zone historically marking the shift from optimism to euphoria,” contributor XWIN Research Japan wrote. “In previous cycles, such as 2017 and 2021, NUPL readings above 0.5 signaled that most investors were in profit, driving speculative activity. Today, around 97% of circulating supply is in profit, reflecting strong market confidence but also suggesting limited upside without consolidation.”Bitcoin NUPL. Source: CryptoQuantSpeculatory entities — those hodling for up to 155 days and defined as short-term holders (STHs) — now make up a record 44% of Bitcoin realized cap. Realized cap is the sum total of the supply at the price at which it last moved. CryptoQuant explains that a high STH ratio implies that newer investors are inheriting the supply from older investors who are taking profit. This includes the largest investor cohort, the whales.“In past cycles, this transfer of dominance from LTH to STH has coincided with the final expansion phase of a bull market,” the post continued. Bitcoin whale realized cap ownership (screenshot). Source: CryptoQuantXWIN acknowledged that the current bull market stands out against the rest. Thanks to large-scale institutional involvement, the impact of realized cap shifts may be reduced.“However, this time the structure appears different: ETF inflows, expanding stablecoin liquidity, and institutional participation are absorbing sell pressure, forming a more stable type of euphoria,” it added.“Overall, on-chain data indicates that Bitcoin is in a mature speculative phase, supported by liquidity and continuous capital inflows. The key signal to watch next will be a decline in STH share, which would mark the start of a renewed accumulation phase led by long-term investors.”BTC price toys with STH profit marginAs Cointelegraph reported, Bitcoin’s STH cohort currently faces a profitability hurdle.Related: $120K or end of bull market? 5 things to know in Bitcoin this weekCryptoQuant puts its aggregate cost basis at $112,500 as of Tuesday, making this week’s BTC price range the key to overall profitability.Bitcoin STH realized price. Source: CryptoQuantThe cost basis, also known as realized price, functions as support during bull-market drawdowns, but its loss can also flip the trend line to resistance.CryptoQuant data indicates that this fluctuation is currently in play, as the spot price bounces above and below the STH cost basis trendline.Bitcoin STH realized price as support/resistance. Source: CryptoQuantThis article does not contain investment advice or recommendations. Every investment and trading move involves risk, and readers should conduct their own research when making a decision."
