,hash,origin,title,author,published,url,text
5,cee4d0fd0572ba8b506b24c379a879fa250cd3d910fcf5c1578ede7dc04ea11a,coin_telegraph,Ether set to go ‘nuclear’ with 3 active ‘supply vacuums’ — Analyst,Martin Young,2025-10-15 00:00,https://cointelegraph.com/news/ether-set-to-go-nuclear-with-3-active-supply-vacuums-analyst,"The price of Ether (ETH) has nowhere to go but up, according to an analyst, with 40% of Ether now out of circulation amid record institutional demand. “Ethereum has never experienced a market cycle with all three supply vacuums active at once,” said analyst “Crypto Gucci” on Tuesday. Crypto Gucci noted that digital asset treasuries (DATs) did not exist in the last market cycle. Over the past few months, DATs have amassed a whopping 5.9 million ETH, worth around $24 billion and equivalent to 4.9% of the total supply, according to StrategicEthReserve. These entities will hold the asset for long-term yields. DATs and ETFs have been hoovering up ETH at record rates this year. Source: StrategicEthReserveSpot Ether exchange-traded funds were also absent in the last cycle. As of today, US-based ETFs have scooped up 6.84 million Ether worth $28 billion, and equivalent to 5.6% of the total supply, despite staking not being approved.  Finally, while staking was in its infancy during the last market cycle, today there is 35.7 million ETH staked, worth approximately $146 billion, and accounting for almost 30% of the entire supply. Most of this is illiquid due to the length of the exit queue, which currently stands at 40 days.  Crypto Gucci stated that Ether has entered this cycle with record institutional demand and the smallest liquid float in its history.“When demand meets a shrinking supply like this, price doesn’t just go up, it goes nuclear.”“With institutional bidding and [ETF] staking approval, I think ETH will rally hard,” said entrepreneur Ted Pillows earlier this week. He predicted a fair value of $8,000 to $10,000 this cycle.Related: Ether ‘3-wave pullback’ to end soon, $5.5K next: FundstratThe Ether supply is marginally inflationary at the moment, but it has only increased by 0.5% since the Merge in 2022, when it transitioned from proof-of-work to proof-of-stake, according to Ultrasound.Money. Compared to this, the Bitcoin (BTC) supply has increased by 4% over the same period. Nation-states next? Another factor that could become a fourth supply vacuum would be if nation-states started stockpiling Ether for their crypto strategic reserves.This week, the Kingdom of Bhutan announced that it was building on Ethereum by integrating its national ID system on the blockchain. However, it does not currently hold any ETH.“It’s awesome that Bhutan is building on Ethereum,” said Ryan Sean Adams from Bankless. “But if Ethereum can’t convert building on Ethereum to holding ETH as a store of value, it’ll never live up to its cypherpunk dreams,” he added. Magazine: Bitcoin’s ‘macro whiplash,’ Shuffle suffers data breach: Hodler’s Digest"
6,908bfcebf0e2109459eccc8331b5ea6b78919ab1db0e491adf48bae04f593451,coin_telegraph,"From $10 to $10,000: How dollar-cost averaging works in crypto",Bradley Peak,2025-10-15 00:00,https://cointelegraph.com/news/how-dollar-cost-averaging-works-in-crypto,"Key takeaways DCA is a trading strategy that uses automated, small, regular buys to stay invested without trying to time every move.There’s a clear precedent for scalability: El Salvador has been publicly DCA’ing 1 BTC per day since Nov. 17, 2022.However, lump-sum investing often wins in uptrends — historically outperforming DCA about two-thirds of the time.It works best for investors who earn regularly in fiat and prefer a steady, rule-based approach over impulsive trading.What is DCA? Dollar-cost averaging (DCA) is the practice of buying a fixed amount of an asset at regular intervals, such as every week or month, without considering price movements.By spreading your entries over time, you lower the risk of mistiming a single large purchase and achieve an average entry price that mirrors the market’s ups and downs.Imagine investing $10 in Bitcoin (BTC) every week. When the price drops, your $10 buys more units; when it rises, you buy fewer. Over time, these purchases average out into a single cost basis.DCA won’t protect you from drawdowns if the asset keeps trending lower. In a steadily rising market, a lump-sum investment often performs better. Use DCA as a tool for discipline and automation to help you stay consistent.Why crypto investors use DCACrypto trades 24/7, with sharp moves as likely on a Sunday night as on a Tuesday morning. In such a continuous market, trying to “pick your moment” is mostly guesswork, which is why many investors prefer a rule that removes the need for perfect timing.DCA provides exactly that: You set the asset, amount and frequency, then let the schedule handle the rest. The result is steady exposure without the pressure to react to every market swing.There’s a psychological benefit, too. A simple, pre-set routine helps curb fear of missing out (FOMO) on green days and panic on red ones. Instead of reacting to headlines, you stick to the plan.It’s also easy to set up. Most major exchanges and wallets now offer recurring buy or “Auto-Invest” options: Just choose your coin, select a weekly or monthly schedule and let the orders run automatically.For anyone building a position from regular income, such as salary, freelance payments or side hustles, DCA fits neatly into everyday finances. It also keeps decision-making calm and repeatable.Did you know? Fundstrat analysis suggests that missing just the 10 best Bitcoin days in a year can wipe out most or all of that year’s gains. Timing perfectly isn’t just hard; it’s costly.Case study: El Salvador’s Bitcoin DCA A real-world example: El Salvador made Bitcoin legal tender in 2021 and chose steady accumulation instead of headline-grabbing bets. On Nov. 17, 2022, President Nayib Bukele set a simple rule: buy one Bitcoin every day — a transparent routine anyone can verify.There have been symbolic top-ups. On “Bitcoin Day” in September 2025, Bukele announced a 21-BTC purchase, taking disclosed reserves to about 6,313 BTC.Also, not every coin came from the market; geothermal mining reportedly added around 474 BTC over three years (small in energy terms, but still additive).How has it worked out? During the late-2024-to-mid-2025 rally, media estimates pointed to unrealized gains of $300 million by December 2024, rising to portfolio values north of $700 million months later, implying hundreds of millions in profit at peak. Figures move with price, but the pattern was clear in that upswing: Disciplined buying built a meaningful position.Indeed, a simple, repeatable rule can act both as a policy signal and as an operational habit for long-term accumulation.Did you know? Strategy (formerly MicroStrategy) has become the largest corporate Bitcoin holder, reporting 640,000 BTC by late September/early October 2025 — an institutional-scale, rules-driven accumulation story.Common mistakes and risks in DCAEven with a high-profile example, DCA isn’t without drawbacks. The main one is opportunity cost. In a rising market, a lump sum often wins because more of your capital benefits from the gains earlier. Studies in equities show lump-sum investing outperforms cost averaging roughly two-thirds of the time, and the same logic can extend to crypto.Next, fees and friction. Many small orders can increase overall costs. Platforms often add spreads on top of explicit trading fees, and onchain transfers include network fees. If your fee structure penalizes tiny orders, making fewer, larger purchases may be more efficient.There’s also execution and venue risk. Standing orders depend on deposits clearing and automations running smoothly, but outages or delays can disrupt the schedule. Using a centralized platform also exposes you to operational, legal and security risks, so decide carefully how you’ll hold your assets.Behavior matters, too. Averaging into an asset that keeps falling still loses money, and DCA often trails lump-sum investing during strong bull markets.Finally, admin and tax: Frequent buys create multiple lots to track. For example, in the UK, His Majesty’s Revenue and Customs (HMRC) pooling rules require careful record-keeping. Check your local tax guidance before enabling “Auto-Invest.”Did you know? Network fees aren’t constant. Around major events (like the 2024 halving and token-minting frenzies), onchain fees spiked even as prices stabilized, so recurring onchain transfers can cost more at busy times.DCA or lump sum? A side-by-side lookWhen (and when not) to use DCADCA suits people who want steady exposure without trying to time every move. If you’re new, short on time or simply prefer a calm routine, a fixed automatic buy helps you stay invested through the noise.It also works well for anyone earning in fiat who can set aside a small, regular amount instead of committing a lump sum. The real advantage is behavioral: You replace impulse with habit and stop second-guessing every decision.Still, it’s not for everyone. If you’re sitting on a sizable cash pile and comfortable with risk, history shows that putting it to work all at once often performs better in rising markets. And if your style involves short-term trading around catalysts, a slow, calendar-based plan won’t fit your goals.A few guardrails help: Pick an amount you can sustain even during drawdowns; automate but check fees and spreads — if small orders cost more, buy less often in larger amounts; decide in advance how you’ll take profit, rebalance or stop (time-based, target allocation or goal-linked); and make a clear custody plan, whether through an exchange, broker or self-custody, with basic security in place.DCA is a discipline tool that rewards simplicity and consistency over speed. Whether it’s right for you depends on your cash flow, risk tolerance and how much you value a steady, rule-based process.This article does not contain investment advice or recommendations. Every investment and trading move involves risk, and readers should conduct their own research when making a decision."
7,0434d723e71aa88b1ee31c2611e15eecca5e7b090ec8df9549055496de687ba6,coin_telegraph,"Crypto crash unlikely to have derailed ‘Uptober,’ analysts say",Martin Young,2025-10-15 00:00,https://cointelegraph.com/news/crypto-liquidation-event-unlikely-derail-bullish-uptober-say-analysts,"The crypto markets are still on track for a bullish October despite a major liquidation event last week, according to analysts and experts, who have compared it to other crypto black swan events. “After the largest liquidation in crypto history, I expected October to be deep in the red,” crypto podcaster Scott Melker said on Wednesday.However, Melker said the markets are still holding on, “which honestly feels like a small miracle,” adding that “I don’t think we’re entering a bear market.”The crypto market capitalization rebounded quickly to reclaim $4 trillion after the weekend rout, but has since cooled off slightly as Bitcoin (BTC) failed to build on its momentum and retreated below $111,000 again on Tuesday. Melker added that this wasn’t 2017 or 2021 when there were major external influences on markets such as “ICO mania, China mining ban or FTX.”“What happened last week was purely structural. The kind of event that forces everyone to stop, reprice risk, and rethink what’s actually possible (and broken) in this market.”Near-term volatility is to be expectedThe path to the cycle top is likely to be volatile, HashKey Group senior researcher Tim Sun told Cointelegraph. “Following last weekend’s aggressive deleveraging, sentiment in the cryptocurrency market has yet to fully recover, and overall risk appetite remains subdued. Price action is relatively sensitive to headline-driven catalysts.”“Near-term volatility is to be expected, but excessive pessimism is unwarranted,” he said, adding that from a medium-to-long-term perspective, “policy easing, de-escalation of tensions, and liquidity repair should remain the dominant themes.”Seasonal influences remain relevant October gained the moniker “Uptober” as Bitcoin has clocked gains in October in ten of the past 12 years. It is currently down 0.6% since the start of this month, but historical trends suggest it could still turn positive by the end of the month. Related: Altcoins typically dump hard before altseason: Will history repeat?Bitcoin has seen the most upside in the second half of the month historically. In October 2024, it gained 16% after Oct. 15, and in 2023 it climbed 29%, while in 2020 it rose 18% in the second half of the month. Most upside comes after Oct. 15. Source: Timothy PetersonMelker also pointed to gold’s epic rally to an all-time high last week, noting that there is usually rotation into Bitcoin that follows. “Investors aren’t panicking, they’re reallocating. And if gold can rally that hard, imagine what happens when capital starts rotating back into Bitcoin.”Other Uptober influences The trade tariff scare that contributed to the weekend crash appears to be waning as a White House official confirmed that President Trump and Chinese President Xi Jinping are scheduled to meet to discuss trade.“Trade conflict is not a zero-sum game; both parties ultimately seek larger shares of the gains, suggesting the eventual outcome is likely to be more moderate than current sentiment implies,” said Sun. Other narratives, such as further Federal Reserve rate cuts this year, and the debasement trade, are also fuelling the sentiment that Uptober is still on track. Magazine: Bitcoin’s ‘macro whiplash,’ Shuffle suffers data breach: Hodler’s Digest"
8,9f6728cf1b7b15ce2d6af9927b97319c3283b30da78b9aa49d5a230432968cd4,coin_telegraph,"Solana traders’ favorite metric flashes, but is $300 SOL by December possible?",Marcel Pechman,2025-10-15 00:00,https://cointelegraph.com/news/solana-traders-favorite-metric-flashes-but-is-300-sol-by-december-possible,"Key takeaways:SOL recovered above $200, but weak onchain activity and rising competition limit the odds of a sustainable rally.Traders show little bearish conviction, yet stagnant network growth and shifting market share keep SOL’s upside capped.Solana’s native token SOL (SOL) climbed back above $200 on Tuesday, recovering from Friday’s flash crash that pushed prices down to $167. Still, the record $1.73 billion in long liquidations left a lasting mark on SOL’s derivatives market, prompting traders to question whether the bullish momentum has faded and if the token can realistically hit $300 this cycle.SOL perpetual futures funding rate, annualized. Source: Laevitas.chDemand for leveraged bullish positions remains muted, as the perpetual futures funding rate hovers around 0%. Under normal market conditions, this indicator typically ranges between 6% and 12%, showing that longs (buyers) are willing to pay to maintain their exposure. Notably, SOL’s funding rate before Friday’s crash was around 4%, already below the neutral range.When the funding rate turns negative, it generally indicates that shorts (sellers) dominate, though this rarely lasts long due to the cost of maintaining those bets. Even so, the ongoing strain in SOL’s derivatives market likely mirrors the broader damage Friday’s liquidations inflicted across the cryptocurrency sector.Weak Solana network activity amid increased competitionSolana’s onchain metrics reveal a persistent lack of bullish momentum, even with SOL trading 31% below its $295 all-time high from January. Network activity has struggled to regain traction since the memecoin frenzy earlier in 2025, and the blockchain has also lost its lead in decentralized exchanges (DEXs) as new competitors gain market share.Solana weekly network fees and DApps revenue, USD. Source: DefiLlamaDecentralized applications (DApps) on Solana generated $35.9 million in weekly revenue, while network fees totaled $6.5 million, marking a 35% drop from the previous month. This slowdown weakens demand for SOL as the payment token for blockchain computation. Lower activity also reduces staking yields for SOL holders, adding further downside pressure.Blockchains ranked by seven-day fees, USD. Source: NansenIn contrast, competing networks such as BNB Chain, Ethereum and Hyperliquid have seen their fees rise significantly, largely at Solana’s expense. BNB Chain’s impressive $59.1 million in weekly fees highlights the success of four.meme, a memecoin launchpad platform fully integrated with Binance Wallet and positioned as a direct rival to Solana’s Pump.fun.Even if one assumes BNB Chain’s momentum is temporary, fees across the Ethereum ecosystem have surged. Layer-2 scaling networks such as Base, Arbitrum and Polygon each saw weekly fees jump by 40% or more. Uniswap recorded its highest-ever weekly fees at $83.8 million, driven largely by activity on Ethereum and Base. Meanwhile, Hyperliquid also benefited from Friday’s market volatility, posting a notable spike in trading fees.To gauge whether SOL traders have turned bearish, it’s useful to examine the balance between call (buy) and put (sell) options.SOL options put-to-call volume ratio at Deribit. Source: Laevitas.chThe SOL put-to-call volume ratio on Deribit has remained below 90% for the past week, signaling weak demand for neutral or bearish positions. Historically, when traders expect a correction, this metric rises above 180%—a level last reached on Sept. 20, following an 11-day, 26.7% rally in SOL’s price.Related: BNB Chain sees record user activity, transactions up 151% in 30 daysWhile SOL’s derivatives metrics may have been distorted by the volatility from Friday’s flash crash, the ongoing weakness in onchain activity as rival blockchains gain momentum is concerning. The rise of Aster, Hyperliquid and Uniswap has come directly at the expense of Solana’s upside potential.Even if traders are not explicitly bearish on SOL, it is unlikely that a single event, such as the potential approval of spot Solana exchange-traded funds in the United States, would be enough to drive its price to $300 in the near term.This article is for general information purposes and is not intended to be and should not be taken as legal or investment advice. The views, thoughts, and opinions expressed here are the author’s alone and do not necessarily reflect or represent the views and opinions of Cointelegraph."
9,6b5fcd9bb3ec1ba27cd03826bd70de9d7d9eca55a1f31ad9c2d038745d8ad81b,coin_telegraph,Bitcoin buyers build bids at $105K as crypto market meltdown nears conclusion,Biraajmaan Tamuly,2025-10-15 00:00,https://cointelegraph.com/news/bitcoin-buyers-build-bids-at-dollar105k-as-crypto-market-meltdown-nears-conclusion,"Key takeaways:Deep liquidity bids now cluster around $105,000-$100,000, signaling market stabilization.Over 90% of BTC supply remains profitable, confirming a leverage-driven, not panic, sell-off.Reclaiming $117,500 could flip the correction into a breakout rally.Bitcoin (BTC) is entering what analysts describe as a “clean-up phase,” as deep buy orders begin to cluster below the $105,000 level following a major deleveraging event.Trading resource Material Indicators said that order book data showed “strong sell pressure on BTC,” with limited technical support around $107,000. While that level might briefly hold, analysts observed that there might not be sufficient bid liquidity to sustain current levels.Bitcoin buy bids data by Material Indicator. Source: XInstead, heavier concentrations of buy orders have appeared from $105,000 to $100,000. A move below $105,000 could bring the yearly open at $93,500 back into focus as a longer-term magnet for price. Meanwhile, blockchain analytics company Glassnode said Bitcoin has begun stabilizing after its recent correction, remaining above the 135-day moving average. The analytics platform said the Young Supply MVRV, which measures unrealized profits among short-term holders, has “reset toward 1.0.” This implied that the market has cooled off from speculative extremes, as newer investors are no longer sitting on outsized profits, helping reduce the pressure for further selling.Bitcoin young supply realized price. Source: Glassnode/XGlassnode also said that the current downturn differs from previous capitulation events. Over 90% of Bitcoin’s circulating supply remains in profit, meaning most of the recent losses came from traders who bought near the top. In previous breakdowns, such as the FTX and Terra Luna crashes, less than 65% of supply was profitable, a sign of broader panic. This time, the correction appears to be a leverage-driven event rather than a widespread sell-off.Adding to that perspective, Bitcoin analyst Axel Adler Jr. said the market’s behavior during the latest pullback reflected a mature response to volatility. Spot trading volume surged to around $44 billion, futures volume reached $128 billion and open interest declined by $14 billion, yet only about $1 billion of those positions were forced long liquidations. In other words, Adler seems to believe that roughly 93% of the deleveraging “wasn’t forced,” pointing to a controlled reduction of leverage rather than a cascading liquidation event.Related: Elon Musk touts Bitcoin as energy-based and inflation-proof, unlike ‘fake fiat’Bitcoin bulls eye rally to $117,500, but will they get it?With the market stabilizing, $117,500 is the key resistance level for bullish continuation. A strong daily close and consolidation above this area could quickly turn the recent correction into a renewed rally within the coming week.However, Bitcoin is likely to trade sideways from $110,000 to $100,000 as it attempts to form a new bottom. The recent low around $101,500, recorded on Friday, may still be tested again before a more convincing range bottom emerges above the $100,000 level.Bitcoin one-day chart. Source: Cointelegraph/TradingViewOn a higher time frame, crypto trader Merlijn observed that Bitcoin is currently retesting the multi-year uptrend that has remained intact since 2022. Historically, this trendline has served as a springboard during each correction of the current cycle. If it holds once again, it would suggest that the broader bull market structure remains intact, and the recent drawdown represents a mid-cycle reset rather than the start of a deeper decline.Bitcoin weekly uptrend analysis by Merlijn the Trader. Source: XRelated: 3 reasons why a Bitcoin rally to $125K could be delayedThis article does not contain investment advice or recommendations. Every investment and trading move involves risk, and readers should conduct their own research when making a decision."
