id,date,preprocess_txt,pos_count,neg_count,sentiment_m2,sentiment_model,sentiment_vader_txt,sentiment_vader_pp
21bced09bb9e1b9f0c514fd3f9bc59b186c6bdd086ea78523283f049110ecee7,2022-10-28,happy friday weekly market highlight initiative binance research team round week summarizing key market event view team macro tradfirishi sunak former chancellor appointed prime minister britain earlier week sunak known crypto enthusiast previously expressed ambition uk global crypto asset hub earlier week european central bank ecb raised interest rate percentage point highest level since size raise expected christine lagarde highlighted mounting risk recession ecb noted expects raise rate already made substantial progress withdrawing monetary policy accommodation october price data released monday current expectation eurozone inflation climb similar move bank canada increased policy interest rate basis point continuing quantitative tightening bank canada increased target overnight rate bank rate deposit rate cryptol week address holding eth throughout year grown million million indicating continued interest holding ethereum l tvl b usd day eye week launch zksync regenesis zksync testnet complete documentation updated binance prepared launch limited mainnet first team launch zkevm zksync could capture significant first mover advantage one feature come along update account abstraction account abstraction provides ability move beyond account work l level externally owned account eoas contract account ethereum every transaction initiated eoa learn zkevms check latest report topic zkevm future ethereum scaling defi tvl b usd day pancakeswap announced community voted proposal deploy aptos end november aave based flashlend market flaave launch flaave supported aave flashstake allowing user deposit asset instantly receive upfront lending yield fixed rate nfts twitter recently announced nfts tweet tile feature link nfts rarible magiceden dapper lab jumptradenft show larger picture nft alongside detail like title creator making easier buy nfts week trading volume nft aggregator blur hit record high eth single day october market share surpassing x looksrare second opensea recently x claimed blur violated relevant term disabled access request blur growth zero royalty marketplace eroded general willingness pay royalty throughout nft space looksrare followed suit looksrare support creator royalty default instead share looksrare protocol fee creator trading reward distribution ratio also updated favor seller aim achieve seller fee basically rebate protocol fee paid crypto adoption google announced launching cloud based node engine service ethereum developer project ethereum first blockchain supported blockchain node engine enabling developer provision fully managed ethereum node secure blockchain access fully managed service customer hire team maintain monitor node recent interview ftx ceo sam bankman fried revealed crypto exchange considering developing stablecoin saying trying find perfect partner work latest binance research publication check latest publication zkevm future ethereum scaling q state crypto market pulseaptos sui new kid blockexplore binance research website project macro research report frequent market update insight follow u twitter binanceresearch minute please share u feedback may via form wrap binance researchread morehttps research binance com en analysisabout binance research binance research research arm binance world leading cryptocurrency exchange team committed delivering objective independent comprehensive analysis aim thought leader crypto space analyst publish insightful thought piece regularly topic related limited crypto ecosystem blockchain technology latest market theme general disclosure material prepared binance research intended relied upon forecast investment advice recommendation offer solicitation buy sell security cryptocurrencies adopt investment strategy use terminology view expressed intended promote understanding responsible development sector interpreted definitive legal view binance opinion expressed date shown opinion writer may change subsequent condition vary information opinion contained material derived proprietary non proprietary source deemed binance research reliable necessarily inclusive guaranteed accuracy warranty accuracy reliability given responsibility arising way error omission including responsibility person reason negligence accepted binance material may contain forward looking information purely historical nature information may include among thing projection forecast guarantee forecast made come pas reliance upon information material sole discretion reader material intended information purpose constitute investment advice offer solicitation purchase sell security cryptocurrencies investment strategy shall security cryptocurrency offered sold person jurisdiction offer solicitation purchase sale would unlawful law jurisdiction investment involves risk,24,17,1.33,neutral,0.99,1.0
aff796bdfa294a7c398fcf876472afd7ad71ccbdb9d0d39a7c244c04deba868e,2022-10-31,activity period utc utc crypto wodl mini game allows user guess mystery word understand latest market development earning crypto reward theme week web music read binance news learn topic participate week wodl user get least five correct answer qualify equal share busd token voucher win play two wodl game daily get total five correct answer activity period eligible equal share busd token voucher tip theme week wodl web music get second wodl day first game click get new wodl share one top news day social medium unlock second wodl game successfully share selected news social medium shared link clicked new user welcome bonus addition new user register binance account using wodl referral code referral link activity period qualify receive spot trading fee busd flexible trial fund voucher within hour successful identity verification participate today wodl related reading week wodl warner music group continues web expansion new metaverse job postingsnoop dogg creates music video via web firm astro projectozzy osbourne dillon francis soulja boy perform decentraland metaverse music festivalterms condition term condition activity term govern participation crypto wodl activity activity participating activity agree activity term following additional term binance term condition prize promotion b binance term use c binance privacy policy incorporated reference term condition case inconsistency conflict activity term incorporated term provision activity term shall prevail followed following order precedence extent conflict binance term condition prize promotion b binance term use c binance privacy policy user complete kyc end activity period shall eligible reward user play two wodl game daily unlock second wodl day click get new wodl first game share top news day social medium sharing deemed successful shared link clicked token voucher reward distributed within one week promotion end able log redeem token voucher via account reward center validity period token voucher set day day distribution learn redeem token voucher new user welcome bonus spot trading fee discount remain valid long binance referral program place future trading fee discount shared inviter last day date future account activation eligible user may redeem busd flexible trial fund voucher via account reward center within hour upon successful identity verification binance reserve right disqualify user reward eligibility account involved dishonest behavior e g wash trading illegally bulk registered account self dealing market manipulation binance reserve right time sole absolute discretion determine amend vary activity term without prior notice including limited canceling extending terminating suspending activity eligibility term criterion selection number winner timing act done user shall bound amendment discrepancy arises translated version original english version english version shall prevail binance reserve right sole discretion amend change cancel announcement time reason without prior notice risk warning digital asset price subject high market risk price volatility value investment go may get back amount invested solely responsible investment decision binance liable loss may incur past performance reliable predictor future performance invest product familiar understand risk carefully consider investment experience financial situation investment objective risk tolerance consult independent financial adviser prior making investment material construed financial advice information see term use risk warning,33,18,1.74,neutral,0.99,1.0
84e0ddf77d06c4f484d6524e73efc6c259cf95bbf7f8265c1f857e144b09bfc3,2022-10-31,year since bitcoin whitepaper published crypto community celebrating occasion noting far asset come bitcoin inspired crypto market present today ethos decentralization seen everything defi web bitcoin first hit crossing decade later despite many dismissal fad bubble traditional finance endured asset continues grow stronger institution invest country adopt legal tender crypto community celebrating th anniversary publishing bitcoin whitepaper happened october market original cryptocurrency eventful life despite remarkably young asset gone lovechild cypherpunks investment vehicle even biggest institution want even country bitcoin journey shared experience many first ardent strong conviction asset every passing year growing throng investor fundamentally decentralized system today market trace back network worth much individual peer make network first individual satoshi nakamoto perhaps group individual regardless enigmatic entity sparked new wave exchanging value visible everything decentralized finance web one first email satoshi metzdowdsatoshi presence still hang bitcoin market cryptic newspaper headline genesis block limited number forum post made newspaper headline come time refers bank bailed british government suggesting displeasure contemporary finance also hint satoshi may british newspaper headline found btc genesis block twitterthe whitepaper seems innocuous enough perhaps even tad academic think would one day reach market value trillion bitcoin fallen peak idea peer peer currency remains strong whitepaper solved difficult double spending problem rest history becoming digital goldthe early day bitcoin small community crypto enthusiast backing seen store value digital gold commonly known hal finney cypherpunk worked closely satoshi bitcoin first receive bitcoin creator next satoshi run node saying famous tweet running bitcoin long bitcoin network launched laszlo hanyecz made first commercial transaction using bitcoin amusing circumstance even get celebration bitcoin pizza day hanyecz purchased two pizza papa john btc sum worth million october laszlo trading bitcoin pizza bitcointalkhis bitcoin forum post also rather charming update since incident place bitcoin history experiment turn revolutionbitcoin parity party discussion bitcointalkbitcoin history consistently marked major milestone continues inevitable march toward adoption asset first hit ten year later cross many ups down bitcoin always come top milestone bitcoin reached include attracting like square tesla microstrategy invested last three among invested bitcoin though square ceo jack dorsey famously supporter cryptocurrency big firm entering crypto market feel inevitable asset grow company invested bitcoin bitcointreasuriesthen entire country adopting bitcoin famously el salvador making cryptocurrency legal tender central african republic well add conviction bitcoin seen asset stand alongside stock real estate simultaneously long short year bitcoin show sign slowing younger tech savvy population take much look forward,27,8,3.0,positive,1.0,1.0
c070ff746c1a80f4a3c8f8c58ac4b41286d0b4713bcc33ce7af24521d291f3ed,2022-11-01,news roundup art block friendship bracelet project explore digital artwork nft physical world come art block addressing certainly obsessed sunset project eric founder art block alexis andr carrying exploration representation digital artwork physical world revealed twitter thread project inspired judd capability facilitate creation extraordinary piece utilizing material easily accessible looksrare becomes latest platform forgo royalty requirement looksrare recently announced longer support creator royalty default instead share looksrare protocol fee creator collection owner hence first zero royalty marketplace support creator directly sharing protocol fee moreover platform modified trading reward distribution ratio favor seller twitter user buy sell nfts tweet twitter declared cooperation four marketplace magic eden rarible dapper lab jump trade enable user buy sell display nfts tweet directly integration known nft tweet tile place nft artwork separate panel within tweet includes button directs visitor listing marketplace seba bank introduces regulated custody ethereum nfts swiss bank seba introduces custody service specialized nfts seba client opportunity deposit ethereum based nft collection bank account like type digital asset new feature give customer possibility hold valuable nfts without manage private key bank hand include token total wealth picture client norway step metaverse decentraland tax office br nn ysund norway central register skatteetaten nation tax authority announced partnering consulting firm ernst young ey establish office decentraland goal initiative according nokios deliver service younger tech native individual establishing web footprint read latest news highlight weeklatest nft drop dvision land mystery boxthe land nft dvision metaverse scarce limited unique virtual plot present limitless capability content creator place user customize personal virtual reality space order establish offer content within virtual estate land digital piece virtual estate dvision metaverse registered nft bep de facto scarce property upcoming nft drop beastmode metaverse x neymarjr human nft collectionmore detail come stay tuned art sport gaming collectible check marketplace discover nfts latest binance nft blog postdisplaying nfts best show collectionthe non fungible token nft market worth billion dollar owner digital artwork thinking hard best way display collection check article discover seven different way people show nfts risk warning value nft go nfts subject high market risk binance responsible verifying identity legitimacy authenticity nft nfts regulated country however please ensure permitted access binance nft marketplace based circumstance detail see binance nft term condition term use risk warning,15,11,1.25,neutral,0.99,0.99
745a02e68acc1d64799a6e7e9b934101700cbad3aa7a6c667f64f2dcd69d7e52,2022-11-01,risk asset including cryptocurrencies recently found footing hope federal reserve fed pivot away jumbo interest rate hike december end called liquidity tightening sooner expected signal nov meeting however major investment bank believe fed could keep door open continued jumbo rate hike potential switch smaller rate hike would necessarily imply early end liquidity tightening fed raised borrowing cost basis point bps year roiling risk asset central bank expected deliver fourth bps hike wednesday lifting borrowing cost range could signal bps step december market appear run ahead pricing slowdown term frequency magnitude rate hike starting december trader expect rate hike cycle peak around terminal rate priced two week ago according future tied fed fund rate bitcoin gained two week dollar index dropped however inflation remains sticky suggesting fed little room turn dovish halt rate hike anytime soon negative sign risk asset data released friday showed fed preferred measure inflation core pce rose month month september august leaving year year increase significantly higher annual inflation target employment cost continue rise double rate registered past year therefore fed could continue hike rate slower pace longer potentially lifting borrowing cost well terminal rate priced market fed stress data dependence next week get two nfp cpi print dec meeting stay hot another bps card deceleration bps possible strategist bank america wrote weekly note sent client friday market badly want pivot slower mean lower fed done hiking data say core cpi cycle high u unemployment cycle low corporates tell u top challenge hiring china u decoupling capex rising food energy increasingly scarce inflationary pressure seem broad based increasingly entrenched short term survey inflation expectation risen fed job done strategist added bofa economist pricing aggressive rate hike path versus fed september projection showed terminal rate peaking bofa bank america global research barclay credit research team voiced similar opinion weekly note saying potential bias smaller rate hike mark dovish pivot true sense word fed need see inflation turning labor market condition deteriorating turning meaningfully dovish think likely retain optionality december see limited downside usd could see broad dollar rebound week barcalys credit research team said dollar rebound likely weigh risk asset including cryptocurrencies bitcoin tends move opposite direction dollar lee hardman currency analyst mufg bank said tuesday client note fed slow pace hike december necessarily mean well total amount tightening delivered current tightening cycle le although initial assumption could fed slows pace hike eventually keep hiking longer hardman added bank expect danske bank early turn soft fed look bp hike hawkish communication fed hike another bp year stop ing may well get step pace tightening december onwards clear inflation far defeated risk rate hike could continue longer seb groupwe expect fed chair powell repeat policy data dependent decided meeting meeting basis also point likely would appropriate slow pace increase thus keeping option table december fomc release new economic rate forecast,10,21,0.45,positive,-0.22,0.59
9294cdf27b53f7cf0beb7bbe85a475c0a7d5b4bcbda415e8ba1d0be2e7e8c674,2022-11-02,article originally appeared valid point coindesk weekly newsletter breaking ethereum evolution impact crypto market ethereum highly publicized recent update merge radically changed second biggest blockchain network work eliminating reliance cryptocurrency miner dramatically reducing energy cost network next upgrade shanghai focus tying loose end month long break ethereum developer reconvened last week typically bi weekly ethereum core developer zoom call motley crew company individual maintain ethereum open source codebase discussed feature intend include network next update developer align timeline full feature set reaffirm core focus shanghai would enable ethereum validators withdraw crypto staked help operate network merge brought proof stake ethereum system pay validators interest stake lock ether eth ethereum native currency network currently staked eth unstaked withdrawn shanghai change validators also gain access whatever reward earned staking alongside withdrawal shanghai poised introduce handful minor developer oriented tweak ethereum protocol list goal still finalized viewable ethereum official github long wished feature however missing shanghai spec sheet least proto danksharding ethereum gas fee user pay complete ethereum transaction famously high making certain kind transaction unaffordable especially true crypto bull market peaked late last year proto danksharding released mark first phase long planned transition sharding method splitting network activity shard way increase capacity bring fee unclear proto danksharding make way ethereum next update last developer call researcher signaled plan feature may finalized next month said ethereum development goal often overly optimistic talk merge happening year ago took place september even proto danksharding make shanghai spec sheet full danksharding vision fully realized version sharding could dramatically improve network usability remains several month year away,9,8,1.0,neutral,0.99,0.98
d3a40cebdf54fbbd5623e0194371eb2d060b549c61c122e6ce43f227e32609a5,2022-11-03,ongoing bear market seen consistent accumulation small large btc address cryptocompare bitcoin btc plunged since hitting peak november last year ongoing bear market may appear brutal previous one considering several industry heavyweight like terra three arrow capital celsius buckled weight market crash yet silver lining according data provider cryptocompare small large investor consistently bought cryptocurrency dip contradicting continued selling seen previous bear market dated november december december december bear market saw bitcoin plunge record high opposed last bear market holder across different wallet size panic selling bear market seen consistent accumulation almost account cryptocompare quarterly report released thursday said account bitcoins seen fair increase likely due increased institutional adoption cryptocompare added per data sourced blockchain analytics firm santiment nine new address owning btc btc created since sept address snapped btc worth billion seven week investor analyst widely use wallet address based metric gauge change demand supply onchain data limitation inferring definite conclusion market activity challenging example user exchange control multiple address word every new address represent new investor crypto exchange often hold user coin multiple address volatility subsideschart show bitcoin become le volatile cryptocompare cryptocompare another positive takeaway latest market swoon decline bitcoin volatility annualised realized volatility averaged past month lower average seen previous bear market according cryptocompare realized volatility measure daily change price security particular period time backward looking different implied volatility option market gauge representing trader expectation price turbulence coming day week month enough bitcoin day realized volatility recently matched wall street tech heavy index nasdaq first instance since per data sourced charting platform tradingview skeptic long criticized bitcoin volatile good store value continued decline price turbulence would welcome development bitcoin volatility steadily stabilising bounded range compared last bear market may suggest cryptocurrencies maturing asset class pattern also typically precede large spike volatility november cryptocompare noted early week arcane research crypto service provider matrixport told client buy straddle capture return potential volatility explosion,10,22,0.43,negative,0.92,0.84
