id,date,preprocess_txt,pos_count,neg_count,sentiment_m2,sentiment_model,sentiment_vader_txt,sentiment_vader_pp
dd597c4db260927590e5a19c1150584a396d070926e77ae87f9132c9eb3bd191,2022-08-08,share lever future trading challenge binance future celebrating addition leverbusd usd perpetual future contract trading challenge win share lever bnb btc busd complete mission challenge attempt trade least busd leverbusd usd perpetual future contract register chart weekthe infamous week maat sunday aug th bitcoin printed second consecutive weekly candlestick week moving average technical perspective week moving average play lot significance bitcoin trend trend following indicator served support macro downtrends btc seen since helping price rebound new uptrend still remains whether history repeat bitcoin lose week moving average support dip lower chain support resistancebitcoin chain activity show significant support floor developed roughly million address bought million btc hand bitcoin face little resistance ahead crucial supply barrier sits address previously purchased btc trader slightly optimistic binance future btcusdt long short ratio rose past week closed sunday aug th ratio trader became optimistic binance future account opened position bitcoin net long weekly market mover note defiusdt composite index perpetual contract consists basket defi protocol token listed binance calculated using weighted average defi token real time price binance denominated usdt find defi index trade defiusdt news roundup soulbound token binance announced would issue binance account bound bab first ever soulbound token sbt built bnb chain explore credential function web develop new use case pave way efficient decentralized community space trade bnbbusd merge vitalik buterin shared merge ethereum complete network would go surge verge purge splurge become scalable trade ethbusd solana attack solana network suffered multi million dollar hacker successfully drained around million smash grab raid user phantom wallet trade solbusd binance mastercard binance partnered mastercard launch cryptocurrency power card customer argentina allowing user spend digital asset everyday purchase reduce gap crypto fiat payment rail highlight weektake part week activitiesliquidity provider program binance upgraded usd margined future liquidity provider program qualified liquidity provider enjoy higher maker fee rebate taker program binance future launched taker program taker fee discount usdt margined perpetual delivery contract fee discount binance future extended fee discount busd margined trading pair new existing user aug st content challenge binance future launched content challenge asking creatives produce video article infographics crypto holder consider trading future platform submit content chance win busd read latest blog posthow make first trade binance future trading pair available binance future grown become world liquid crypto derivative exchange allowing user avoid unnecessary risk guide explains get started binance future join million active trader today trade new listingsbusd contract binance future launched busd margined auction uni perpetual contract x leverage coin contract binance future launched coin margined en perpetual contract x leverage cross margin binance added bond new borrowable asset cross margin bond busd bond usdt new trading pair cross margin new updatestick size binance future adjusted tick size jasmy usd perpetual future contract increase market liquidity improve trading experience european option binance conduct product upgrade european style option end q note binance encourages user trade responsibly trading engaging fun trading serious business lead financial emotional distress trading derivative carry risk cryptocurrencies digital asset often high level price volatility risk warning future trading subject high market risk margin balance may liquidated event adverse price movement value investment go may get back amount invested binance liable loss may incur provide financial advice information see term use risk warning,23,22,1.0,neutral,0.82,0.99
b54d4fe4e10217cb871f3b471ef619fca3bcea3544585d31ece3aa7bf595430a,2022-08-08,digital asset investment product saw inflow totalling last week marking sixth consecutive week inflow according weekly report coinshares sixth consecutive week inflow brings total inflow streak coinshares said bitcoinbitcoin product saw outflow totalling report said short bitcoin product saw record outflow totalling coinshares said noting outflow second consecutive week suggest investor believe bitcoin price troughed ethereum ethereum saw inflow totalling enjoying near consecutive week run inflow totalling believe turn around investor sentiment due greater clarity timing merge coinshares said source coinshares,2,0,2.0,positive,0.88,0.88
a26603f469c4c709a0bccc0bdc45e7f8e5ee9c3ab15460ddaef1b53972ac28db,2022-08-09,expectation merge long awaited improvement ethereum network primary factor recent rebound cryptocurrencies according jp morgan think market found bottom despite low trading volume bitcoin btc ether eth increased respectively since mid june low overall market value cryptocurrencies regained trillion according data coinmarketcap monday note client jpmorgan analyst kenneth worthington primarily ascribed shifting economics cryptocurrency market planned ethereum merge switch blockchain proof work pow proof stake po worthington said helped believe limited new contagion implosion terra luna successful ethereum merge boon crypto marketsnevertheless jpmorgan analyst belief real impetus ethereum integration favorable statistic following unveiling sapolia ropsten testnets early july june indicating merge feasible despite trade volume remaining look cryptocurrency market found floor worthington disclosed jpmorgan stated successful ethereum unification later year help bolster investor confidence integration anticipated occur september pending performance next georli testnet test scheduled take place august one final step prior merge ethereum successful integration later year according jpmorgan expected help boost investor confidence image analytics insight pow po sending positive vibethe price bitcoin increased july price ethereum increased roughly compared may back encouraging news regarding cryptocurrency shift pow po system intended increase network speed mining efficiency addition jpmorgan observed capacity bitcoin ethereum rise since june low another indication market reached bottom bitcoin price fallen percent since time high nearly november last year july decentralized finance also increased worthington pointed considering defi tends constructed ethereum alleviation early concern defi better news regarding ethereum merge likely behind exceptionally large price rise eth comparison bitcoin crypto investor seek much needed boost confidence long term revival cryptocurrency market may dependent imminent ethereum merge,19,3,4.75,positive,0.99,0.99
c305be54a2d4e94098288428bd579e921dd6a62faaa2007dc8b16a92fe75291e,2022-08-09,crypto payment become popular especially following bull market run million merchant worldwide accepting cryptocurrency payment direct indirect integration even big corporation jumped bandwagon nevertheless crypto payment still remain early stage still good number place worldwide user pay good service using cryptocurrencies however ethereum founder vitalik buterin expects change soon crypto going mainstreamin recent interview ethereum founder vitalik buterin shared thought regarding crypto payment fast expects grow founder spoke session korea blockchain week kicked sunday mostly focusing ethereum buterin shared crypto payment would going mainstream actually ethereum merge merge expected happen sometime september expected make ethereum network faster cheaper use founder expects network upgrade bring ethereum fee low merge completed achieved making improvement efficiency accessibility crypto according buterin ethereum devs hard work two year effort regarding merge buterin also highlight speech pointing fact rollups part development made make network faster cheaper use fee structure vitalik buterin highlight speech one major hindrance total mainstream crypto payment adoption come larger transaction fee may seem inconsequential problem arises coin like eth need used smaller payment everyday purchase buterin pointed fact transaction accessible people living low income country many people around world quietly using crypto international payment already founder said lower income country lot opportunity crypto payment lie ahead well benefit digital technology efficiency safety reason alone restructuring network make room cheaper transaction fee going cent must achieved buterin expects transaction fee drop cent rollups implemented going forward founder belief network reach low cent lower improvement,17,5,2.83,neutral,0.92,0.97
b8e9d19e32b05ead44a51cc05840b98686d4a68fce8af7c693452f68eb31b3fb,2022-08-11,blackrock world largest asset manager announced thursday website launched spot bitcoin private trust client trust available institutional client based u intended track performance bitcoin le expense liability trust blackrock said despite steep downturn digital asset market still seeing substantial interest institutional client efficiently cost effectively access asset using technology product capability announcement said firm also said conducting work permissioned blockchains stablecoins cryptoassets tokenisation announcement come shortly blackrock announced partnership u based crypto exchange provide client access trading digital asset blackrock managed roughly trillion asset january according reporting financial time,8,3,2.0,neutral,0.96,0.98
ab31a570f6bbbde5e63115d1023f9282cadd41b69a498496e2424ad52f1671d3,2022-08-12,huge week crypto wild swing direction stand btc currently since monday eth despite recent price action many coin convert portal seen volume decrease compared last week whilst price simultaneously increased excluding one interesting could suggest recent move strong originally anticipated fundamental event sent market frenzy week firstly u cpi data suggested inflation slowed july result tradfi crypto market rallied secondly eth merge track mid september goerli test merge finalised earlier week earlier last week sol suffered exploit fund drained wallet trade top weekly coin interest convert portal volume breakdowntopping list week stablecoin swap value convert portal offer tight spread across stablecoins found crypto stablecoin transaction nd highest week reaching unsurprisingly market rallying sustained trending period investor look cash market increase stablecoin crypto transaction third week value market uptrending investor fueling rally enter new position overall market technicalsbtc cpi sends btc frenzy since market crash month ago btc formed bullish market structure breaking previous high week bullish nature amplified cpi data released btc rallied back k previous resistance turned support identified week back well respected since start month price successfully traded level new range high stand btc formed new range high short lived btc retracted failing break k order bullish momentum continue likely need see k hold break back k otherwise likely see another retest weekly support coinciding h trendline formed last month eager optimist calling start new bull run whilst pessimistic bear saying midst bear rally time tell crypto fear greed index showing fear within market increasing point since last report solsol coin interest week price whilst seeing significant volume decrease bull run last year seems like lifetime ago sol one best performing coin however currently since peak nearly currently sol trading around since forming low last month trading strong uptrend forming series higher low however recently sol failed trade previous high set accompanied volume divergence may suggest move long lasting always altcoins determined btc next move critical level anything happen trade safe crypto calendar eth goerli merge monero network upgrade token singaporenews event noteus inflation eas cpi data came beating expectation resulting btc rallying k alongside tradfi market blackrock expands btc offering blackrock world largest asset manager launched spot bitcoin private trust news found trade otc binance offer client two potential way trade otc first binance convert found binance convert offer quick simple way execute crypto trade across trading pair added every week start simply navigate convert webpage select coin wish trade preview confirm quote settlement completed instantly refresh quote many time like alternatively larger block trade k voice trading available coverage expert team available round clock help suit trading need offering tight competitive spread best class service get touch binance otc team trade request advice question may start finish team every step way experience main benefit binance convert otc trading fast competitive pricing instant settlement widest availability coin bespoke service unique market insight zero fee slippage email liquidity binance comjoin telegram stay date market,27,19,1.35,positive,0.99,0.99
9b057d62ba259851c791651fb72f6eac480c45bd604118298e39601def4babdc,2022-08-12,makerdao co founder rune christensen recently proposed removing usdc dai stablecoin peg stability module suggested usdc within worth billion could used buy eth instead yet despite conversion could boost eth price vitalik buterin said terrible idea removing exposure usdcin governance channel makerdao official discord rune expressed concern u treasury department latest sanction privacy protocol tornado cash lot serious first thought said think seriously consider preparing depeg usd continued adding transition almost inevitable done large preparation one way could involve called uprooting yolo usdc eth approach word tuesday circle ceo jeremy allaire said circle issuer usdc forced comply treasury department sanction tornado cash due bank secrecy act requirement used authority freeze usdc sanctioned address related entity crypto community since begun discussing risk related centrally issued stablecoins prone state enforcement censorship capture contrast makerdao dai decentralized stablecoin backed handful digital asset reserve comprised usdc second half contains eth le centralized cryptos theoretically converting usdc reserve eth could remove risk makerdao asset frozen circle bolster eth price boot however ethereum co founder vitalik buterin board plan seems like risky terrible idea tweeted eth drop lot value collateral would go way cdps would get liquidated whole system would risk becoming fractional reserve decentralizing stablecoinsthe developer added dai could mitigate centralization risk diversifying reserve asset comprises total alternatively suggested applying negative interest rate dai reign growth makerdao discord rune recognized conversion could increase risk dai losing dollar peg still belief partial uprooting could worth risk think market may finally start reward decentralization point risk acceptable usdc longer brainer used said fear around decentralized algorithmic stablecoins abounded since terrausd ust former third largest stablecoin collapsed may token indirectly backed highly volatile luna crumbled price asset put pressure month terrausd meltdown luna foundation guard conducted similar plan rune buying billion dollar bitcoin stablecoin reserve however later forced sell bitcoin failed attempt protect ust fledgling peg,8,22,0.35,neutral,-0.95,-0.93
a23822aa17c23bd4d7058cdc9a72ebe17756647c10fec859d093624d1c5449ed,2022-08-12,news roundup samsung collaborates theta lab forthcoming galaxy nft ecosystem samsung theta lab collaborated collection nfts accompanying launch latest galaxy phone according company consumer experience innovation promoted nft ecosystem linking virtual world perk real world coca cola launch new nft polygon network coca cola continues web journey launching first nft collection american giant coca cola released new nft collectible international friendship day bubble inside coke bottle mainly inspire design new nfts instagram introduces nft feature country meta owned instagram announced nft feature available country along integration coinbase wallet dapper wallet flow blockchain region include america asia pacific middle east africa feature allowing instagram user showcase nft collection previously available u limited number creator trust wallet becomes main partner wallet meta instagram nft initiative trust wallet crypto storage wallet owned binance recently partnered tech giant meta extend support eth matic nfts instagram mark trust wallet main partner wallet meta instagram nft initiative read latest news highlight weeklatest nft dropseuropean league football nd mystery box drop jersey nftsarchloot mystery boxfitr genesis gbagupcoming nft dropsatta rolling festival pas augusthalo augusthoney shot fancy bear augustshellorbzupcoming amajoin u aug utc exciting ama halo learn join binance nft community telegram follow binance nft twitter instagram latest news update read latest blog postall utility nfts unique token practical application utility nfts built give token holder certain perk like passive income earning opportunity learn various type perk utility nft holder enjoy enhance introduce new way interacting risk warning value nft go nfts subject high market risk binance responsible verifying identity legitimacy authenticity nft nfts regulated country however please ensure permitted access binance nft marketplace based circumstance detail see binance nft term condition term use risk warning,13,9,1.3,neutral,0.99,0.99
1084897280f188b9a94ac3864bf7b1bfbb53a12fc5424c6420dc8718d29e5726,2022-08-12,happy friday weekly market highlight initiative binance research team round week summarizing key market event view team macro tradfithis week world two largest economy provided relieving data around surging inflation u consumer price index cpi july percent smaller expected rise percent june lower petrol price contributed drop annual rate growth unchanged percent questionable whether move represent large enough cool federal reserve fed stop tightening monetary policy third consecutive percentage point rate rise central bank next policy meeting september possible china also reported lower expected rise cpi july country reported cpi percent driven increased pork vegetable price lower u still highest month month increase recorded nation highest level two year cryptoethereum third final testnet merge went live goerli testnet merge take project one step closer ethereum mainnet upgrade later year addition two previous testnet merges ropsten sepolia also largely successful top ethereum core developer suggest tentative date merge developer debated date would suitable target decided epoch bellatrix upgrade ttd paris would translate september bellatrix september paris final merge expected take place bellatrix mainnet upgrade end september latest binance research publication check latest publication rise decentralized autonomous organizationshalf year report algorithmic stablecoins explore binance research website project macro research report wrap binance researchabout binance research binance research research arm binance world leading cryptocurrency exchange team committed delivering objective independent comprehensive analysis aim thought leader crypto space analyst publish insightful thought piece regularly topic related limited crypto ecosystem blockchain technology latest market theme general disclosure material prepared binance research intended relied upon forecast investment advice recommendation offer solicitation buy sell security cryptocurrencies adopt investment strategy opinion expressed date shown may change subsequent condition vary information opinion contained material derived proprietary non proprietary source deemed binance research reliable necessarily inclusive guaranteed accuracy warranty accuracy reliability given responsibility arising way error omission including responsibility person reason negligence accepted binance material may contain forward looking information purely historical nature information may include among thing projection forecast guarantee forecast made come pas reliance upon information material sole discretion reader material intended information purpose constitute investment advice offer solicitation purchase sell security cryptocurrencies investment strategy shall security cryptocurrency offered sold person jurisdiction offer solicitation purchase sale would unlawful law jurisdiction investment involves risk,13,10,1.18,neutral,0.91,0.96
e928d8248c971da0b8e9af7ba00ff959dcb9b7d7502994633250c1ca8b541e63,2022-08-15,digital asset investment product saw outflow totalling last week according coinshares report coinshares said flow data reveals opinion divided regionally inflow totalling european exchange outflow american exchange difficult discern meaningful change sentiment given small size although minor outflow seen across broad set provider coinshares said also come time low trading volume recovery price suggesting could element minor profit taking bitcoin bore brunt outflow totalled last week coinshares said short bitcoin product saw minor inflow totalling blockchain equity saw inflow last week coinshares said source coinshares,2,2,0.67,neutral,0.04,0.27
eaed0e47b75027766c0d1feed0adabb0c3e778ee8f9e67988eed2960347fe60a,2022-08-16,staked eth ethereum network reached new milestone million number long time making recorded tremendous growth since announcement month ago contract sits whopping million eth staked rising passing day total number eth staked account total supply mean ethereum available supply rendered unmovable foreseeable future expected big impact price since scarcity equal higher value ethereum able cross first time month anticipation around merge turned buy news event people moving digital asset given promise held ethereum time add fact withdrawal expected come network month year merge reduced market supply continue pump price ethereum investor strap inan important byproduct announcement merge coming september accumulation trend triggered example number address holding least eth hitting new month high trend seen smaller investor holding least coin touched new time high wallet address early hour monday wu blockchain reported long dormant ethereum wallet activated wallet balance eth said active ico era network garnering total eth time price eth hit back owner wallet made single transaction eth activity since wallet since gone transfer eth multiple wallet since reactivation trend becoming common merge draw closer mostly investor buy news price eth dramatic rise however seen past expected price eth likely decline merge,3,2,1.0,positive,0.81,0.93
