id,date,preprocess_txt,pos_count,neg_count,sentiment_m2,sentiment_model,sentiment_vader_txt,sentiment_vader_pp
efd5bb6636f8bccd96e531b174da60da6414d22f9d6e9ea78bfa987f5f69cacd,2022-10-11,news roundup nfts soar high u trademark application nfts filed till date trademark application surpassed trademark filed huge difference amazing number recorded time popular celebrity influencers brand gone nfts sony music entertainment moet hennessy others like ninja turtle slime mean girl singer like miley cyrus begun nft journey cool cat nft expand web gaming offering strategic investment animoca brand partnership drive cool cat mission become prominent global nft brand robust medium content company red hot collab particular expected expand brand blockchain gaming offering yuga lab selects member form bayc community council council main duty support web initiative within bored ape community yuga list potential use case council support commercial product gathering charitable activity read latest news highlight weekneo fantasy neo fantasy blockchain based acgn metaverse game combine nft defi gameplay depth creating acgn world full surprise user like explore metaverse acgn rpg game upcoming nft drop klay thompson grail mystery box collectionhealth fitness web ecosystem amino launch nft collection celebrating klay thompson incredible career featuring artwork championship golden state warrior nft mystery box available sale exclusively binance nft marketplace october drop include mystery box available rare nfts set include exclusive klay thompson memorabilia autographed jersey basketball photograph art sport gaming collectible check marketplace discover nfts read latest blog postnft authentication combating fake nfts scamsthe nft market worth billion dollar nfts unique nfts may well fake created scammer read learn protect better understanding nft authentication work risk warning value nft go nfts subject high market risk binance responsible verifying identity legitimacy authenticity nft nfts regulated country however please ensure permitted access binance nft marketplace based circumstance detail see binance nft term condition term use risk warning,22,12,1.69,positive,0.98,0.99
8ccabe38d4afde4eb606f9c48819437adbc98d9a22151f9ab27413370735cf37,2022-10-12,since bitcoin quietly launched creator technology spurred thousand digital money project creating vibrant lucrative landscape investor investor come sort flavor small group geeky believer diverse crowd people cypherpunks big mainstream company large investment fund cryptocurrencies gaining traction investment asset investor showing interest wider variety crypto asset bitcoin expert told coindesk shift digital gold landscape institutional crypto investor definitely shifting recently say ajit tripathi former investment banker barclays goldman sachs recently head institutional business decentralized finance defi project aave talking sovereign fund manager last week started making token investment tripathi told coindesk interview said least fund managing sovereign wealth entire country started taking baby step crypto beyond bitcoin investment kind usually exceed fund total allocation biggest part would bitcoin crypto exposed venture fund pantera z among others however allocation could also invested smaller cryptocurrencies invest hundred million dollar tcoin would put half bitcoin ether half venture fund like pantera z small part learning exercise token tripathi said bitcoin looked like safest bet eye institution due inflation hedge digital gold narrative also bitcoin one two crypto asset cleared regulatory risk u security exchange commision however bitcoin narrative changing attention slowly moving newer project including ether matic atom sol well gaming defi token tripathi said instance goldentree billion private asset manager bought worth sushi token digital asset sushiswap decentralized exchange dex crypto really seen institution asset class tripathi said however since couple thing helped bring serious attention crypto u government unleashing money printer covid pandemic paypal introducing cryptocurrency trading custody service tripathi said legitimization mainstreaming crypto asset class pretty much accelerated added tyler spalding co founder payment startup flexa agrees said institutional fund increasingly looking token issued decentralized trading protocol including uniswap compound sushiswap stablecoins v cbdcs one crucial part crypto market infrastructure stablecoins cryptocurrencies maintain stable price pegging coin asset fiat currency u dollar two biggest dollar backed stablecoins tether usdt usdc stablecoins might soon challenged central bank digital currency cbdc according eswar prasad professor cornell university former international monetary fund imf official author future money digital revolution transforming currency finance emergence cbdcs displacement cash cbdcs almost certainly become reality already see china japan sweden central bank initiating experiment cbdcs suspect economy issue cbdcs next three five year prasad told coindesk unlike stablecoins running decentralized permissionless ledger ethereum tron central bank favor ecosystem control little chance government world allow stablecoins par cbdcs latter place said john kiff former senior financial sector expert imf always place private stablecoins gray market use case capital control avoidance added bigger market probably open stablecoins kiff said tokenized security country already experimenting issuing security blockchain settling digital currency helvetia project recently piloted bank international settlement swiss national bank six exchange kiff said see project like expanding year come especially developing economy however advanced economy sophisticated security market putting infrastructure new rail take added u see much limited pilot kind next three five year kiff said christopher giancarlo former commodity future trading commission chairman crypto dad friendly attitude towards crypto belief room healthy competition cbdcs privately issued stablecoins least free world said ajit tripathi think otherwise cbdcs find actual use case developed economy privately issued stablecoins become integral part banking system much regulated probably become something similar bank regulatory sense long follow rule part payment rail tripathi said stablecoins acquiring banking charter gaining similar regulatory status one two year away tripathi belief rail builderswhat mean investor technical legal infrastructure created next generation digital payment building infrastructure benefit transformation invest builder example project creating enterprise system ethereum r corda quite popular cbdcs pilot around world might investor looking said kiff project like stellar algorand avalanche may also likely candidate provide country tech cbdcs added flexa spalding belief decentralized protocol governance token compound uniswap become ultra successful year come use model platform revenue distributed among token holder traditional company shareholder alex mcdougall ceo technology startup stablecorp belief viable hardened tested disputed decentralized governance model worked industry next seven year however going take year model withstand expected battle court regulator meantime company building bridge among blockchains fiat currency trading platform necessarily decentralized way reaping benefit unlocking trillion dollar friction tax locked financial service system right mcdougall said referring fee service hiccup happen switching one currency blockchain another bitcoin standard holding onall trend mean oldest largest cryptocurrency market cap lost attractiveness investor expert say anything considered benchmark crypto market profitable coin precarious either bitcoin kind reserve currency crypto market said kiff think almost like index fund crypto market good place park money investing anything specific bitcoin likely keep status especially stick root proof work system although complain much kiff said added cryptocurrencies bitcoin remains decentralized going far without glitch anything bitcoin worked like clockwork since pretty impressive kiff said giancarlo former cftc chairman said past week revealed interesting trend u dollar gaining strength past year global reserve currency losing steam bitcoin british trader selling pound buy dollar bitcoin continuing trade narrow range around trader selling bitcoin buy dollar way selling yen buy dollar selling pound buy dollar time global economic stress many traditional currency diminished value bitcoin giancarlo said,43,19,2.15,positive,1.0,1.0
e4c3c7e53f3b1d8c2efd644993227e8afc2532ad93ebd72a874beacb47a997fd,2022-10-14,october happy friday weekly market highlight initiative binance research team round week summarizing key market event view team macro tradfiu inflation september increased year year stronger expectation year year despite hot consumer price index cpi print stock market staged turnaround trading day closed higher suggesting inflation concern may somewhat priced cpi print trader currently assign probability fed raise interest rate november cryptol someone say deflation ether turned deflationary week eth burned issued decline supply eth since oct contributed launch token resulted increase gas fee context ether estimated deflationary gas price gwei greater l race launch working zero knowledge ethereum virtual machine zkevm heating week polygon announced launch public zkevm testnet aave uniswap lens midnight society amongst first protocol deploy zkevm testnet scroll released upgraded version pre alpha testnet enables smart contract deployment scroll allows user bridge erc nfts scroll l l testnets zksync estimated launch mainnet end october additionally zksync evm compatible l pathfinder prototype deployed public testnet q defi defi exploit week mango market solana based defi platform exploited u templedao yield farming defi protocol hacked u nfts nft royalty sparked debate within nft community support royalty others argue royalty necessary source income creator week degods popular solana nft project switched royalty model founder cited growing popularity royalty marketplace major push factor opensea nft marketplace added support avalanche brings total number supported blockchains seven ethereum polygon klaytn solana optimism arbitrum avalanche web x crypto google announced allow selected customer make payment cloud service digital currency starting next year latest binance research publication check latest publication layer scaling market updatedefi bnb chainsoul searching soulbound tokensexplore binance research website project macro research report frequent market update insight follow u twitter binanceresearch minute please share u feedback may via form wrap binance researchread morehttps research binance com en analysisabout binance research binance research research arm binance world leading cryptocurrency exchange team committed delivering objective independent comprehensive analysis aim thought leader crypto space analyst publish insightful thought piece regularly topic related limited crypto ecosystem blockchain technology latest market theme general disclosure material prepared binance research intended relied upon forecast investment advice recommendation offer solicitation buy sell security cryptocurrencies adopt investment strategy use terminology view expressed intended promote understanding responsible development sector interpreted definitive legal view binance opinion expressed date shown opinion writer may change subsequent condition vary information opinion contained material derived proprietary non proprietary source deemed binance research reliable necessarily inclusive guaranteed accuracy warranty accuracy reliability given responsibility arising way error omission including responsibility person reason negligence accepted binance material may contain forward looking information purely historical nature information may include among thing projection forecast guarantee forecast made come pas reliance upon information material sole discretion reader material intended information purpose constitute investment advice offer solicitation purchase sell security cryptocurrencies investment strategy shall security cryptocurrency offered sold person jurisdiction offer solicitation purchase sale would unlawful law jurisdiction investment involves risk,17,15,1.06,neutral,0.98,0.99
dcbd5ab42a46df600fc0ccbda7b6987bb9a3da1ed9d11aad0f1cd86a7122e0a4,2022-10-14,oct ada made top week coin seemed bulletproof bull run fallen victim bear market currently ada trading around since ath testing january support despite ada recent upgrade coin performance remains lacklustre however stage market individual coin performance determined overall outlook ada one keep close eye near future rsr largely affected market week coin currently seen volume drop past week rsr continues introduce new development recently announced first data protecting stablecoin eusd info found twitter surprisingly reef outperformed market week amidst turmoil project recently announced new partnership pax world goal make metaverse accessible reef currently last day trade top weekly coin interest convert portal volume breakdowncoming first week stablecoins swap value slight decrease compared last week tight spread across pair stable swap please visit convert portal second week crypto stablecoin transaction value decreasing since last week market moving sideways extreme short term rally overall direction remains unclear trader exiting short term position applies stablecoin crypto transaction clear direction sight trader playing level level range whilst investor look average position low overall market technicalsbtc cpi cause huge intraday volatility starting week btc making slow grind downside still trading tight weekly range prior u cpi announcement wednesday range bound day btc saw limited action trading steady consolidation phase geared thursday announcement yesterday cpi announcement caused huge intraday drop across market btc fell quickly reversed momentum shifted btc rallying one biggest intraday shift seen looking chart see btc dropped retested downtrending line identified back rallying upside currently btc trading around testing last week short term support resistance bull remain control need break resistance hold chance return back alternatively bear regain control move upside classed short squeeze market liquidates short seller intention returning back towards bottom range crypto fear greed index showing extreme fear within market reef outperforming market despite current condition current market condition majority altcoins underperforming trading downside reef outperformed market currently last day looking chart see reef trending upwards since start september despite rest market tumbling currently trading near september resistance bull need see break hold level order continue towards upside one thing consider although price rapidly increasing volume decreasing indicating movement may strong expected price fails break resistance reef likely make return towards uptrending support level news event notecrypto layoff continue crypto trading firm nydig cut workforce following sustained bear market condition price continue rise thursday u inflation figure came higher expected september news found introducing new otc chat function otc desk excited announce launch new spot block trading chat function accessed via binance platform looking trade large ticket size increased amount communication channel available user trade otc allowing trade completed seamlessly securely binance otc platform experienced trader ready guide entire otc process offering white glove service tight competitive spread across pair get started need registered kyc verified account asset readily available trade make way spot block trading page found please note minimum ticket size k smaller size please use binance convert portal email liquidity binance comjoin telegram stay date market,20,22,0.87,neutral,0.84,0.94
61cb0bf6ece2487abd0123547992e03ddaeb416afa40cc33a5506168f3676d0e,2022-10-18,news roundup coinshares release experimental ai bot try calculate fair price nft experimental project called coinsharesnftai aggregate different set data provide user determines fair price crypto twitter split another nft platform move opt royalty solana based magic eden become latest nft marketplace shift optional royalty model following footstep x august optional royalty model buyer given power set royalty want contribute nft project meaning chance creator may receive royalty artwork sold mattel cryptoys bring man nfts flow blockchain occasion th anniversary master universe franchise cryptoys take fan favorite character motu mattel metaverse along limited edition digitalized action figure nft game scratching surface possible animoca brand co founder yat siu belief matter time advanced model created designed around idea digital ownership interoperability economic utility user konami japanese gaming firm hunting nft talent many business advance nft web metaverse zone konami japanese gaming company join race video game company announced job opening expand offering metaverse nft web platform read latest news highlight weekcalling binance nft creator trying learn story behind artist please fill short questionnaire chance guest speaker nft artist amas http form gle pxnjfwm aetau appreciate detail captivating story share feedback always looking improve feedback help u best pinpoint area need work harder giving away busd user detailed insightful feedback get rewarded input share feedback latest nft drop klay thompson grail mystery box collectionklay thompson four time nba champion warrior five time nba star klay thompson mystery box nfts first grail collection nfts celebrate klay amazing career recent championship warrior nba season mystery box sale including box reserved community art sport gaming collectible check marketplace discover nfts latest binance nft blog postnfts motion new era entertainment industrynfts recently conquered one creative medium another finally making debut big screen nfts innovative way raise fund engage viewer power fan economy read learn nfts disrupting entertainment industry risk warning value nft go nfts subject high market risk binance responsible verifying identity legitimacy authenticity nft nfts regulated country however please ensure permitted access binance nft marketplace based circumstance detail see binance nft term condition term use risk warning,18,10,1.64,neutral,1.0,1.0
4e92d0b857f695034ebb8f039e910102baed222cbef5f50318d93c94b2eab96d,2022-10-20,crypto market capitalisation increased third quarter although overall sentiment market remains poor binance research said thursday latest quarterly report state market q state crypto market pulse report binance research said uncertain macro environment general risk sentiment mean market wood yet source binance researchsentiment reflected widely watched crypto fear greed index largely tracked fear zone throughout much year report noted although also noting index marked marginal improvement third quarter bitcoin ethereum bnb remain top three coin market capitalisation year date excluding stable coin report said total value locked tvl defi protocol remained range bound quarter tracking roughly billion regulatory uncertainty frequency exploit continue weigh overall sentiment report author jiexuan chua shivam sharma stefan piech kevin son wrote non fungible token nfts also tough quarter sale quarter quarter report said bright spot number unique buyer held saw slight uptick quarter gamefi bnb chain ethereum polygon account almost game bnb chain highest number game built chain according report,5,8,0.56,positive,-0.08,-0.7
1164607680bb8fa27bb8bdeb7bb06faa7b8f4de474da3e56638e3292bf8dff3e,2022-10-21,week seen lesser known altcoins take huge leap trading volume increasing drastically pha trading volume exploded last week subsequent price rise outperforming rest market pha recently listed major exchange contributed increase trading volume product continues develop information twitter page apt made trading debut earlier week listed binance alongside major exchange coin quickly plummeted last hour certain user eligible airdrop entitling token expected current market condition entitled would quickly look grab quick risk free profit lto cvp also saw huge increase volume week currently whilst remains unclear cause pump pattern seen time time within crypto trade top weekly coin interest convert portal volume breakdownthis week relatively stable crypto btc trading tight range volume transaction remained almost identical last week topping list stablecoin swap value decreasing ever slightly tight spread across pair stable swap please visit convert portal crypto stablecoin trade placed nd week value increasing narrative remains clear cut direction sight market participant average position stablecoin crypto came third value decreasing overall market technicalsbtc remains unchanged btc still remains stuck trading within tight weekly range last week btc bounced resistance level around appeared shift market structure price failed trade significant high since start month possibly hinting room downside looking chart bear remain control narrative potential target last week low depending whether hold weekly range always potential bullish scenario bull need weekly range hold make slow return upside cement move would also need see price break previous support turned resistance touching volume significant change volume slowly declined towards end week current lack direction extremely difficult gauge market heading likely require extreme news black swan event patiently wait btc gear next big break crypto fear greed index showing extreme fear within market phaearlier week pha broke upside extended period sideways movement volume spiked suddenly subsequent price rise currently pha look trading wedge pattern common occurrence amongst coin huge unexpected rally coin move unpredictable manner determined btc next move interestingly lto cvp formed exact pattern look identical amongst always volume sharply declined indicating move may strong anticipated news event notetether expands operation tether recently announced rd november usdt available throughout brazil atm apt airdrop layer blockchain aptos recently airdropped coin causing price sell news found trade otc binance offer client two potential way trade otc first binance convert found binance convert offer quick simple way execute crypto trade across trading pair added every week start simply navigate convert webpage select coin wish trade preview confirm quote settlement completed instantly refresh quote many time like alternatively larger block trade k voice trading available coverage expert team available round clock help suit trading need offering tight competitive spread best class service get touch binance otc team trade request advice question may start finish team every step way experience main benefit binance convert otc trading fast competitive pricing instant settlement widest availability coin bespoke service unique market insight zero fee slippage email liquidity binance comjoin telegram stay date market,23,22,1.0,positive,0.97,0.99
