id,date,preprocess_txt,pos_count,neg_count,sentiment_m2,sentiment_model,sentiment_vader_txt,sentiment_vader_pp
d6de9deb67acc800647acee67b33e0fa40df50016b8d1d5a5b8c631c77ab783f,2022-09-05,share busd trading busd future binance future announced new promotion reward community eligible user may share busd voucher reward regular user must confirm registration trade minimum busd equivalent eligible busd future contract participate promotion addition user never traded future prior promotion qualify receive busd future bonus voucher first come first served basis join promotion chart weekbitcoin risk sunday sep th bitcoin remains risk steep correction technical perspective btc printed three consecutive weekly candlestick close week moving average threatening dip lower bitcoin need reclaim week moving average support chance recovering surging toward week moving average miner sell chain data show number btc held affiliated miner wallet dropped past week bitcoin miner sold roughly btc worth million aug th sep th optimism prevails binance future btcusdt long short ratio continues go higher price drop closing sunday sep th ratio trader appear expect bitcoin recover binance future account opened position btcusdt net long net short weekly market mover note defiusdt composite index perpetual contract consists basket defi protocol token listed binance calculated using weighted average defi token real time price binance denominated usdt find defi index trade defiusdt news roundup flooding market eric wall mt gox creditor summarily dismissed report roughly btc sent creditor would soon dumped market reality payout occur tranche month trade btcbusd seaport polygon announced seaport new open source web marketplace protocol safely efficiently buying selling nfts launched opensea trade maticbusd wagmi temple development arm shiba inu shared detail concept upcoming shib metaverse wagmi gon na make temple introduce zen like realm calm meditation natural beauty sensation spiritual connection world trade shibbusd supply chain vechain announced partnered trutrace technology developer fully integrated blockchain platform legal cannabis food apparel pharmaceutical industry trade vetusdt burn cake pancakeswap bnb chain based decentralized exchange burned cake token worth roughly million highlight weektake part week activitiesmulti asset mode switch multi asset mode become one lucky user win need follow step promotion win binanceblockchainweek binance blockchain week paris week ahead binance launched series online activity giveaway share bnb busd travel credit community crypto wodl theme week wodl sport user participating week wodl getting least five correct answer qualify equal share busd token voucher taker program binance future launched taker program taker fee discount usdt margined perpetual delivery contract oct st fee discount binance future extended fee discount busd margined trading pair new existing user oct st content challenge binance future launched content challenge asking creatives produce video article infographics crypto holder consider trading future platform submit content chance win busd trade new listingsusd contract binance future launched usdt margined football fan token index footballusdt perpetual contract x leverage cross margin binance added ava new borrowable asset cross margin ava busd ava usdt new cross margin pair new updateseuropean option binance perform product upgrade european style option end q note binance encourages user trade responsibly trading engaging fun trading serious business lead financial emotional distress trading derivative carry risk cryptocurrencies digital asset often high level price volatility risk warning future trading subject high market risk margin balance may liquidated event adverse price movement value investment go may get back amount invested binance liable loss may incur provide financial advice information see term use risk warning,29,18,1.53,positive,0.89,1.0
ad3a84b3b41c32b8856c6b057083fa1ffa9ebbcb5e8c2dd30326d7845f4b8866,2022-09-06,binance lab invested project country since inception web project founder interested connecting binance lab follow team twitter keep tab upcoming program event biswap first decentralized exchange dex lowest trade fee multi type referral program bnb chain us automated market maker amm model fulfill order offer low trading fee well multi type referral system biswap one winner valuable builder mvb ii program passion level professionalism way business project differentiate binance lab partner said robi head support spokesperson biswap prior partnership binance lab biswap already gained user traction built novel referral program however always easy build trust young maturing crypto industry partnership binance lab venture capital vc arm largest exchange trading volume brought biswap seal approval amongst crypto community immediately announcement binance lab saw huge inflow user daily active trader increased two three time robi added trading volume also grew four five time mean lot crypto user binance lab invests company binance lab also introduced multiple bnb chain project biswap new found trust respect biswap gained faster access broader range web project bnb chain accelerated business development day cz signed agreement one moment team remembered robi added binance lab connected u whole ecosystem project also seamless way getting linked various project bnb chain growing project budding web project looking work binance lab robi recommended three thing consider build quality innovative secure project benefit usersbring valuable development larger web ecosystembe transparent respectful towards investor crypto community,23,0,23.0,neutral,1.0,1.0
8b7fb6bcf53d98b2faef987d25647bc83a3f1c063d2d2c35702f799aa164df5e,2022-09-09,happy friday weekly market highlight initiative binance research team round week summarizing key market event view team macro tradfithe ecb raised rate basis point week decision unanimously backed member governing council raising interest rate ecb aim bring eurozone inflation target still lot uncertainty europe record high inflation august eurozone ongoing energy crisis political uncertainty country italy ukraine much likely move u closer stagflationary scenario high unemployment little growth looking ahead ecb staff significantly revised inflation projection inflation expected average lagarde see probably two increase come including latest one also probably le five according cme probability u fed raising interest rate bps september probability bps cryptothe merge nears excited update see leaving impact already currently eth trading highest price relative bitcoin btc year eth btc also see merge leaving impact decentralized finance defi protocol earlier week aave voted pause eth borrowing following concern user try maximize eth pow airdrop similar news compound passed vote set limit eth borrowing addition large borrower face higher interest rate reasoning protocol currently possibility potential pow airdrop incentivizing investor borrow eth lending pool risking liquidity constraint liquid staking side lido steth saw price curve dropping eth currently investor derivative platform lido receive pow ethereum airdrop incentivizes investor swap binance published first kyc soulbound token together launch binance research closer look soulbound token sbt binance account bound bab token soulbound token used proof identity binance user completed kyc verification user able mint bab token bnb chain identity credential participate building multiple project earn reward couple project bnb chain introduce bab token identity credential community sbts offer publicly visible non transferable token help foster decentralized society creating immutable record research team belief use case sbts wide ranging complementing current nft landscape sbts enable creation better trust relationship decentralized environment also offer significant improvement protocol read soul searching soulbound token latest binance research publication check latest publication soul searching soulbound tokenstokenomics deep diveuncovering defi fundamental decentralized exchangesexplore binance research website project macro research report wrap binance researchabout binance research binance research research arm binance world leading cryptocurrency exchange team committed delivering objective independent comprehensive analysis aim thought leader crypto space analyst publish insightful thought piece regularly topic related limited crypto ecosystem blockchain technology latest market theme general disclosure material prepared binance research intended relied upon forecast investment advice recommendation offer solicitation buy sell security cryptocurrencies adopt investment strategy use terminology view expressed intended promote understanding responsible development sector interpreted definitive legal view binance opinion expressed date shown opinion writer may change subsequent condition vary information opinion contained material derived proprietary non proprietary source deemed binance research reliable necessarily inclusive guaranteed accuracy warranty accuracy reliability given responsibility arising way error omission including responsibility person reason negligence accepted binance material may contain forward looking information purely historical nature information may include among thing projection forecast guarantee forecast made come pas reliance upon information material sole discretion reader material intended information purpose constitute investment advice offer solicitation purchase sell security cryptocurrencies investment strategy shall security cryptocurrency offered sold person jurisdiction offer solicitation purchase sale would unlawful law jurisdiction investment involves risk,13,11,1.08,neutral,0.99,0.99
5e133cf2b63c368f08eb5a9c98066d712afa1a1e6a3bd2ba06cef829be26f4ab,2022-09-09,news roundupsony music file crypto related trademark sony music filing trademark application columbia record logo plan use nft backed medium music podcast production artist management music distribution service z introduces free nft licensing framework control ownership venture capital firm andreessen horowitz also known z set enable free nft licensing framework provides six type lawyer vetted license creator use control ownership artwork firm come move primary goal unleash economic potential digital artwork sector lg tap hedera blockchain nft marketplace user able explore buy sell trade nfts lg smart television set lg art lab also incorporate onscreen qr code enable user complete transaction help company crypto wallet smartphones called wallypto also built hedera vitalik buterin book proof stake also available nft co founder world popular smart contract ethereum vitalik buterin releasing physical digital book proof stake also available nft book revealingly comprised various writing last ten year prime focus nft book read latest news highlight weeklatest nft dropwin nft hero mystery box utc pm utc win nft hero gamefi nft multi chain strategy game hero win nft hero position tank attacker indispensable winning battle hero class gene form bond substantially boost squad performance battle hero card genesis sale utc hero card brand new card game launched x world game different dream card v v simple card competition format entertaining gameplay combination easy get started hero card collectible designed famous artist acgn art style kryptomon nft hunter club utc kryptomon play earn blockchain game trainer kryptomon explore vast world kogaea care kryptomons serve well pvp battle trainer around world dedication skill pave road victory mystery box contain everything need become strongest snazziest looking trainer fearless kryptomon fight side limited edition digital physical hoodie much super box star duke utc star duke innovative decentralized gaming metaverse user explore various civilization universe series provides planetary land r base spacecraft essential asset star duke nft holder enjoy game earn income staking trading leasing new feature updateslist nfts bulk binance nft marketplaceyou list delist nfts mystery box binance nft marketplace bulk using new batch list feature learn read latest blog posthow nfts transforming membership experience organization brand use nft based membership system reward customer supporter access granted user connect crypto wallet organization platform verify ownership membership nft token unlock suite online offline perk access exclusive event service much read find risk warning value nft go nfts subject high market risk binance responsible verifying identity legitimacy authenticity nft nfts regulated country however please ensure permitted access binance nft marketplace based circumstance detail see binance nft term condition term use risk warning,32,11,2.67,neutral,1.0,1.0
8358fb206e58f03a80abe879fb566a1633872cdd56a85558f9104bb81ce16c64,2022-09-09,week started rocky market btc sold earlier week breaking short term support identified previous report expected rest market followed suit yesterday experienced higher usual volatility following federal reserve chair jay powell speech market saw swing either direction rallying early hour morning bst flux coin interest week outperforming rest market currently last day whilst unclear caused surge flux coin entered top coin cmc earlier week take look chart see find sol made list week despite drop convert portal volume currently last day trade top weekly coin interest convert portal volume breakdowntopping week stablecoin transaction figure increasing quite substantial increase compared previous week likely due recent stablecoin announcement read second crypto stablecoin coming week decrease indecisive move seeing market short long term investor exit position possible stablecoin crypto transaction third list value buyer still remain confident average position overall market technicalsbtc powell sends btc frenzy mentioned earlier week market rocky start experienced sell prior powell speech thursday majority yesterday btc traded within tight range breaking upside delayed reaction powell speech previously seen previous pattern btc spiking shortly announcement however time round delayed fuse currently btc trading around broke last week previous short term resistance bull keep control narrative need see level act support order target next level alternatively move short squeeze fake june low mentioned last week still valid btc could make reversal crypto fear greed index showing extreme fear within market fluxflux coin interest week outperformed majority market gaining last day looking chart since crash back june flux formed time low since trading strong uptrend unclear led strong increase flux considering btc experienced sell offs throughout august flux currently trading approached previous major support level momentum continue need see flux successfully trade previous support level could target previous resistance one thing cautious despite strong movement price volume declining indicating may organic expected crypto calendar eth mainnet merge eos mandel upgrade ada vasil upgrade token singaporenews event notepolygon expands operation despite recent crypto layoff polygon popular l scaling solution aiming hire new employee bayc rise bayc outperforms rest nft market last hour seen sale worth k shib whale attack two biggest shib whale increased holding billion totalling shib token news found binance execution solution whilst binance convert portal rfq block trading great simple way execute trade across wide range crypto pair sometimes efficient method especially illiquid pair binance developed way round using agency execution algos provides intelligent solution optimise execution execution algos facilitate execution large crypto trade reducing average cost execution market signalling algorithmic execution already widely used traditional financial market majority large volume trade market executed via algo order binance execution algos fully optimised cryptocurrency market executing order smaller block logic based strategy order type include time based twap volume based strategy information algos found email liquidity binance comjoin telegram stay date market,22,22,0.96,positive,0.99,0.99
86b4a6680edc5837da05a3ca205b77781a27e4cb1be668f877996da7a74599f9,2022-09-12,u dollar restrained ethereum supposedly bullish upgrade merge almost star seem aligned favor ether eth yet native token ethereum blockchain underperforming bitcoin btc since friday bitcoin rallied since friday ether lagged gaining according coindesk data ether underperformance stem trader rotating money eth btc observer told coindesk contrast others blamed caution ahead merge increased interest buying staked ether steth token ether lagging bitcoin eth btc trigger rotation money eth eth btc ratio trading back previous high started unwind long eth short btc trade caused rally btc beta adjusted bitcoin outperformed ether last week markus thielen chief investment officer british virgin island based ideg asset management ideg said email eth btc ratio topped sept highest since december amounting rally july low trader piled ether ahead long awaited merge however momentum weakened since perhaps trader lightening eth long btc short position typically happens asset run key resistance strong rally level capped upside multiple time since may ratio run long held resistance tradingview lewis harland researcher decentral park capital made similar observation citing rebound bitcoin dominance rate long held support catalyst movement money eth btc bitcoin dominance chart showing bullish rsi divergence trader seem moving money btc eth harland said btc dominance floor since bitcoin dominance rate refers leading cryptocurrency share broader crypto market dominance rate crashed roughly nearly three month sept impending merge drew demand ether press time dominance rate stood bullish divergence relative strength index popular gauge price momentum signaling scope continued rise caution ahead mergesome investor seem worried merge running problem failing live expectation funding rate disparity eth btc switched investor hedge possibility underwhelming receipt merge james webb research associate london based data aggregator index provider cryptocompare said resultant decrease short interest btc also allowing bitcoin continue outpace ether return webb added funding rate refers cost holding long short bullish bearish position perpetual future market probability merge failing quite low may immediately bring store value appeal ether trading firm qcp capital recently warned increased preference stethaccording ideg thielen trader increasingly looking purchase lido staked ether token steth discount taking away buy side pressure ether spot market early quarter trader snapped ether sold future collect potential ethereum fork token ethpow free without directional risk however incentive take called ethpow trade weakened trader could make higher return snapping steth heading merge notably estimate expected pow airdrop initially priced expected around thielen said discount staked ethereum lido v ethereum narrowed might offer better value ethereum investor pow fork unlikely lead significant airdrop press time steth changed hand eth decentralized exchange curve improvement low three month low eth reached early last week volume steth lido dramatically increased million million end last week price rising sign many trader would rather steth participate air drop thielen noted,18,15,1.12,positive,0.98,0.98
6c2726135ad0785adf0432a64421a076b247d1bed740d74738dfa20d745fa405,2022-09-12,starbucks sbux set begin non fungible token nft based loyalty program blockchain technology provided polygon company starbucks odyssey allow customer purchase digital collectible stamp nft form offer benefit immersive experience program built polygon proof stake po network scaling tool sits top ethereum network application run polygon scaler avoid high cost low transaction speed caused congestion ethereum mainnet starbucks hinted developing web experience may year announced plan launch series nft collection providing unique experience community building customer engagement customer invited join waitlist receive access starbucks odyssey starting today,3,1,1.5,neutral,0.77,0.76
34a6c279dd3c13cb2e7922cb111dd8dd6d0b50f56e9c40291255720b213099d7,2022-09-12,digital asset investment product saw outflow million last week marking fifth consecutive week outflow coinshares said weekly report monday outflow remain relatively small size totalling million past week coinshares said volume remain year average billion week ethereum main focus week million outflow ahead merge come despite improved certainty merge perhaps highlight concern amongst investor event might go planned coinshares said merge upgrade ethereum network transition blockchain consensus mechanism proof work proof stake according report bitcoin saw fifth consecutive week outflow totalling million short bitcoin investment product saw inflow totalling million altcoins saw inflow totalling million report said noting mostly polygon cardano million source coinshares,2,1,1.0,negative,-0.2,0.15
ee44cd0576356c3a0bb22c91144cb74242061e1cbc4e984f50e2aeaf026bbe76,2022-09-13,new binance option trading platform launchesbinance launched new binance option trading platform sep th available binance website binance app click learn chart weekbitcoin rebound sunday sep th bitcoin rebounded time high technical perspective btc yet reclaim week moving average support better chance recovering advancing week moving average note potential rejection week moving average could trigger downswing time high high network grows number new daily address created bitcoin network appears rising suggests spike interest sidelined investor scoop token around current price level network growth often considered one accurate price predictor cryptocurrencies generally steady increase number new address created given blockchain start new price uptrend disbelief binance future btcusdt long short ratio taken u turn closing sunday sep th ratio trader appear believe bitcoin gain limited binance future account opened position btcusdt net short net long weekly market mover note defiusdt composite index perpetual contract consists basket defi protocol token listed binance calculated using weighted average defi token real time price binance denominated usdt find defi index trade defiusdt news roundup new integration chainlink announced hyphen oracle network partnered northwest node glink solution launch custom decentralized oracle network chainlink trade linkbusd open source polygon announced pil zk toolkit open source allowing developer worldwide use polygon creation within permissive bound apache mit license trade maticbusd underwater algorand foundation announced million usdc exposure troubled singapore based lender holdnaut pursuing legal mean recover fund trade algousdt pro crypto uk elected new prime minister liz truss said several year ago nation welcome cryptocurrencies way constrain potential highlight weeklet celebrate binance future rd anniversary binance future launched wide range activity celebrate third anniversary anyone creates share binance future related content social medium stand chance win share busd binance future rd anniversary limited edition nfts also releasing binance future rd anniversary nfts collaboration binance nft follow u official twitter account binancefutures join festivity make sure use hashtag binancefuturesturns win take part week activitiestaker program binance future launched taker program taker fee discount usdt margined perpetual delivery contract oct st fee discount binance future extended fee discount busd margined trading pair new existing user oct st content challenge binance future launched content challenge asking creatives produce video article infographics crypto holder consider trading future platform submit content chance win busd trade new listingsusd contract binance future launched usdt margined spell lunc luna perpetual contract x leverage cross margin binance added lunc new borrowable asset cross margin lunc busd lunc usdt new cross margin pair new updatesmulti asset mode binance updated maximum deposit limit margin asset used trading usd future multi asset mode leverage margin tier binance future adjust margin tier eth usd perpetual contract eth coin perpetual contract new leverage margin tier note binance encourages user trade responsibly trading engaging fun trading serious business lead financial emotional distress trading derivative carry risk cryptocurrencies digital asset often high level price volatility risk warning future trading subject high market risk margin balance may liquidated event adverse price movement value investment go may get back amount invested binance liable loss may incur provide financial advice information see term use risk warning,21,17,1.17,positive,1.0,1.0
